Name;Text;OriginalText;Tags
Demacia;Demacia est un royaume fort, fondé sur des lois strictes et riche d'un passé militaire prestigieux. Ses habitants ont toujours attaché une grande importance aux idéaux de justice, d'honneur et de devoir, et ils sont très fiers de leur héritage culturel. Mais malgré ses valeurs très nobles, cette nation parfaitement autosuffisante est devenue de plus en plus insulaire et isolationniste au cours de ces derniers siècles.\n\nAujourd'hui, le royaume de Demacia traverse une période trouble.;;Demacia
Demacia;La capitale, la Grande cité de Demacia, a été fondée pour servir de refuge contre la sorcellerie après le cauchemar des Guerres runiques et a été bâtie sur le mystère de la pétricite, une étrange pierre blanche pouvant saper l'énergie magique. C'est de là que la famille royale a toujours veillé à la défense des villes et villages alentours, ainsi que des terres agricoles, des forêts et des montagnes riches en ressources minérales qui constituent le royaume.\n\nCependant, après le décès soudain du roi Jarvan III, les autres familles nobles n'ont toujours pas approuvé la succession au trône de son unique héritier, le jeune prince Jarvan.;;Demacia
Demacia;Tous ceux qui vivent au-delà des frontières bien gardées du royaume de Demacia sont perçus avec une suspicion grandissante, et en ces temps de doute, beaucoup d'anciens alliés se tournent vers de nouvelles sources de protection. Certains osent murmurer que l'âge d'or de Demacia est révolu et que si son peuple ne parvient pas à s'adapter à un monde en constante évolution, ce dont beaucoup le jugent incapable, le déclin du royaume est inévitable.\n\nEt toute la pétricite du monde ne pourra protéger Demacia de lui-même.;;Demacia
Demacia;L'histoire de Demacia et de sa culture découlent du cataclysme des guerres runiques. Là où les survivants qui avaient fui le conflit s'étaient aventurés à l'ouest de Valoran dans l'espoir d'établir la sécurité loin du chaos. Certains disent que c'est alors qu'un culte de mages noirs terrorisait ces survivants déplacés, qu'ils se sont cachés dans une forêt ancienne et pétrifiée où les sorciers qui les poursuivaient ont soudainement découvert que leur magie était rendue inefficace par les bois étranges. Décidant de profiter de la puissance unique de cet environnement, ces vagabonds s'installèrent de façon permanente.\n\nFinalement, la connaissance de ce nouveau royaume curieux a atteint d'autres réfugiés, qui sont venus chercher asile et solidarité avec la magie qui ravageait le reste de Runeterra. En peu de temps, les colons unis s'étaient construits une communauté importante, alliée au sein d'une nouvelle nation qu'ils allaient appeler Demacia.;The history of Demacia and its culture stems from the cataclysm of the Rune Wars. Where survivors who fled from the conflict had ventured into the west of Valoran with the hope of establishing safety away from the chaos. Some say it was while a cult of dark mages terrorized these displaced survivors, that they hid in an ancient and petrified forest where the sorcerers that chased suddenly found their magic was made ineffective by the strange woods. Deciding to take advantage of the unique power from this environment, these vagabonds set up a permanent residence.\n\nEventually, knowledge of this curious new realm reached other refugees, who came seeking asylum and solidarity from the magic that was ravaging the rest of Runeterra. Within a short time, the united settlers had built themselves a sizable community, allied under a new nation they would come to call Demacia.;Demacia
Demacia;De nombreux réfugiés ont fui les horreurs des guerres runiques. L'un de ces réfugiés était Kilam, accompagné de ses filles jumelles Kayle et Morgana. Originaire du Mont Targon, leur père a cherché une vie plus sûre pour ses filles, après que leur mère Mihira soit devenue l'hôte de l'Aspect de la Justice. Plusieurs années se sont écoulées, et les guerres runiques stoppèrent. Un jour, les sœurs reçurent du ciel la Lame de feu stellaire de leur mère, avec laquelle elles débloquèrent leurs pouvoirs célestes, devenant des hôtes transfigurés supplémentaires pour les aspects de la justice. Ensemble, ils ont juré de protéger leur nouvelle maison : Demacia.;Many refugees fled the horrors of the Rune Wars. One such refugeee were Kilam and his twin daughters Kayle and Morgana. Hailing from Mount Targon their father sought a safer life for his daughters, after their mother Mihira became and ascended host of the Aspect of Justice. Several years have past and the conclusion of the Rune Wars, one day the sisters have received their mother's Starfire Spellblade from the sky and with which they unlocked their celestial powers, becoming additional ascended hosts for the Aspects of Justice. Together, they vowed to protected their new home of Demacia.;Demacia, Kayle, Morgana, Ascended
Demacia;Lors de la bataille de Zeffira, Kayle et Morgana ont volé pour aider les habitants de Zeffira. Alors que Kayle était occupée à faire face à l'attaque de première ligne, Morgana appris qu'une vague cachée d'ennemis attaquait la ville et quitta les lignes de front pour aider les citoyens. Après la bataille, Kayle perdu confiance en sa sœur pour l'avoir laissée sur le champ de bataille.;Kayle and Morgana flew to aid the people of Zeffira. While Kayle was busy dealing with the frontline attack, Morgana learned of a hidden wave of enemies attacking the city and left the frontlines to aid the citizens. After the battle Kayle lost trust in her sister for leaving her on the battlefield.;Demacia, Kayle, Morgana
Demacia;Les habitants de Demacia découvrirent rapidement que leur patrie était riche en ressources naturelles, ce qui engendra le développement des infrastructures pour les nouvelles villes et les terres agricoles a augmenté de façon exponentielle. Mais avec le progrès et la richesse sont venus des adversaires de ce royaume naissant, faisant en sorte que Demacia soit constamment en désaccord avec des conquérants ambitieux.;Demacia’s inhabitants were quick to discover their homeland was rich in natural resources, the development of infrastructure for new cities and farmlands grew exponentially. But with progress and wealth came adversaries to the fledgling kingdom, ensuring that Demacia was at constant odds with ambitious conquerors.;Demacia
Demacia;Il n'y aurait aucune crainte que des envahisseurs se battent en profitant d’artillerie magique, et ainsi la petite infanterie d'élite de Demacia aurait toujours l'avantage lorsque des menaces surviendraient dans leur patrie. Mais toutes les batailles n'ont pas eu lieu à l'intérieur des frontières protectrices du royaume, car les ennemis les plus rusés tentaient d'attirer l'armée de Demacia où ils seraient beaucoup plus sensibles aux attaques des arcanes. Cherchant un moyen de protection plus avancé, les dirigeants de Demacia enrôlèrent Durand, le plus grand artisan de l'époque, pour sculpter un instrument mobile qui pourrait être utile dans les guerres à l'étranger. Dévoilé plus tard pour être une statue de titan, il avait la forme de moitié homme et moitié rapace, comme le natif de Silverwing dans les hautes terres. Éprouvé difficile à transférer dans et hors de Demacia mais incontestablement efficace une fois sur le champ de bataille, le Colosse a été utilisé dès que nécessaire depuis.;Yet there would be no fear of invaders capitalizing on magical warfare, and so Demacia's small but elite infantry would always have the advantage when threats took place in their homeland. But not every battle took place within the kingdom's protective boundaries, as the most cunning enemies would attempt to draw out Demacia's army where they would be far more susceptible to arcane attacks. Seeking out a means for more advanced protection, the leaders of Demacia enlisted Durand, the greatest artisan of the time, to sculpt a mobile instrument that could be useful in wars set abroad. Later unveiled to be a statue titan, shaped in the form of half man and half raptor- like the Silverwing's native to the highlands. Proven difficult to transfer in and out of Demacia but unquestionably effective once it was out on the battlefield, the Colossus has been used when necessary ever since.;Demacia
Demacia;Il y a plus d'un siècle, l'expansion de Noxus rapprocha dangereusement les forces du royaume des terres protégées par Demacia. Lors du premier et légendaire affrontement de leurs nations, le roi Jarvan I est entré en guerre avec Noxus pour les terres du sud.\n\nMais Noxus ne s'incline pas, le héros de guerre Sion chargea les demaciens, avec pour seul objectif de tuer leur roi. Les gardes royaux de Jarvan pensaient pouvoir arrêter sa charge. Ils avaient tord. Il les abattus, un par un, jusqu'à ce qu'il ne reste plus que lui et le roi. Battue et fatiguée, Sion continua le combat contre le roi. Il combattu Jarvan au-delà du point de rupture et a finalement été surpassé... mais pas battu. Avec son dernier souffle, il referma ses doigts autour de la gorge du roi et brisa la volonté d'une nation. Le roi demacien, Jarvan Ier, était mort.;More than a century ago, Noxus expansion brought the empire forces dangerously close to the lands protected by Demacia. On their nations' first and legendary clash, the King Jarvan I went at war with Noxus for the southern lands.\n\nBut Noxus wouldn't bow, the war hero Sion Sion charged against the demacians, with the only true focus of killing their king. Jarvan's royal guardsmen believed they could halt his charge. They were wrong. He cut them down, one by one, until only he he and the king remained. Battered and fatigued, Sion continued the fight the king. He battled Jarvan beyond the point of breaking and was finally bested... but not beaten. With his dying breath, he locked his fingers around the king's throat and broke the will of a nation. The Demacian King, Jarvan I, was dead.;Demacia, Sion, Jarvan
Demacia;Malgré le fait que Demacia soit un royaume cherchant à se protéger de la magie, plusieurs de ses habitants possèdent des pouvoirs arcaniques, connus ou non de la société. C’est par exemple le cas de Sylas, qui a été emprisonné pour ne pas contrôler sa magie et avoir tué plusieurs personnes, ou de Luxanna Crownguard, qui contrôle la lumière mais qui a du garder son pouvoir secret pour protéger le status de noblesse de sa famille.;;Demacia, Sylas, Lux
Demacia;Le royaume de Demacia (communément appelé Demacia) est une nation située dans la partie ouest de Valoran, partageant ses frontières avec Freljord et est proche de la frontière avec Noxus.;The Kingdom of Demacia (commonly referred to as Demacia) is a nation located in the Western part of Valoran, sharing its borders with Freljord and is close to bordering with Noxus.;Demacia, Freljord, Noxus
Demacia;"La Grande cité de Demacia est la plus grande ville du Royaume. La capitale, située dans la partie ouest de Demacia, est le principal centre politique, culturel, religieux, militaire, économique et éducatif du pays. Demacia se considère comme un phare d'espoir pour l'humanité, et à ce titre, la nation et sa capitale sont les représentations visuelles de ce concept. Des bâtiments en flèches imposantes ponctuent son horizon ; La pétricite (une pierre pâle et résistante à la magie) et le marbre sont les matériaux de choix. Les maisons nobles qui résident dans la ville comprennent Buvelle, Crownguard et Laurent. Le Palais Royal de la Maison Lightshield est à partir duquel le roi de Demacia règne. La ville possède également une caserne et un pénitencier, comme la plupart des villes du royaume. La capitale elle-même se trouve à côté d'un port surplombant la Mer du Conquérant, la majorité des villes environnantes reposant sur un plateau.";"The Great city of Demacia is the largest city in the Kingdom. The capital, located in the western part of Demacia, is the main political, cultural, religious, military, economic and educational center of the country. Demacia sees itself as a shining beacon of hope for humanity, and as such, the nation and its Capital are the visual representations of this concept. Towering spires punctuate its skyline; Petricite (a pale, magic-resistant stone) and marble are the materials of choice.The noble houses that reside within the city include Buvelle, Crownguard and Laurent. The Royal Palace of House Lightshield is from which the king of Demacia reigns. The city also has a barracks and a penitentiary, like most cities throughout the kingdom. The Capital itself sits next to a harbor overlooking the Conqueror's Sea, with the majority of the surrounding towns resting on a plateau.";Demacia
Demacia;Dans le nord de Demacia se trouve le Monument de Galio. Situé sur la route du Mémorial, c'est le lieu de repos du colosse connu sous le nom de Galio.;In the North Demacia City is the Galio Monument. Situated on the Memorial road, it is the resting place of the colossus known as Galio.;Demacia, Galio
Demacia;"Le Cercle des Illuminateurs est un ordre clandestin dont le siège se trouve dans les Salles Sépulcrales, la principale partie religieuse de Demacia. Les Illuminateurs sont l'un des rares groupes de Demacia où les mages sont acceptés ; les membres sont chargés de protéger les frontières du royaume. L'un de ses membres est Lux.";"The Circle of the Illuminators is a clandestine order headquartered in Sepulchral Halls, the main religious part of Demacia. The Illuminators are one of the few groups in Demacia where mages are accepted; members are tasked with protecting the kingdom's borders. One of its members is Lux.";Demacia, Lux
Demacia;Le Temple des Porteurs de Lumière est l'une des plus anciennes structures de la capitale, ce temple honore la légende des Protecteurs Ailés (Kayle et Morgana), qui incarnent les idéaux Demaciens du devoir, de l’honneur et de la tradition.;The Temple of the Lightbringers is one of the oldest structures in the capital, this temple honors the legend of the Winged Protectors (Kayle and Morgana), which embody the Demacian ideals of duty, honor, and tradition.;Demacia, Kayle, Morgana
Demacia;Le complexe des Chercheurs de Mages est un grand quartier général pour les Chercheurs de Mages. Ce bâtiment se distingue par son impressionnant aigle colossal en marbre qui se dresse au sommet du bâtiment. Il abrite également des mages demaciens qui sont emprisonnés et enfermés afin de ne pas semer le chaos et la destruction dans la capitale. Il abrite également le tristement célèbre Sylas.;The Mageseekers Complex is a large headquarter for the Mageseekers, this building stands out because of its impressive colossal marble eagle standing in top of the building. It also houses Demacian mages which are imprisoned and locked in order not to wreak havoc and destruction in the Capital. It also houses the infamous Sylas.;Demacia, Mageseekers, Sylas
Demacia;Le Registre des Arcanes est une grande bibliothèque sécurisée qui abrite tous les tomes, parchemins et autres matériaux magiques confisqués. Seuls les nobles sont autorisés à y accéder. Il y a au moins un coffre-fort verrouillé qui contient les rouleaux composant les textes originaux de Durand, tels que les spécifications de conception de Galio.;The Arcane Registry is a large secured library which houses all confiscated magical tomes, scrolls, and other materials. Only highborn are allowed access. There is at least one locked vault that holds the scrolls making up Durand's original texts, such as the design specs of Galio.;Demacia, Galio
Demacia;Les Aigles d'Azurite sont une espèce aviaire prédatrice qui vit dans les parties nord de Demacia. Leur nom vient de leurs plumes bleues à couleur presque azur. Très rarement vus, ces oiseaux chassent les petits animaux, mais sont également capables d'attaquer les plus gros comme les chevaux et les Tuskvores, et même parfois de s’attaquer à des humains. Il y a quelques exemples d'Aigles d'Azurite domestiqués, comme Valor de Quinn.;Azurite Eagles are an avian predatory species that live in the northern parts of Demacia. Their name comes from their blue to almost azure like feathers. Very rarely seen, these birds hunt small animals, but are also able to attack larger ones such as horses and tuskvores, even sometimes unexpecting attacking humans. They are some examples of domesticated azurite eagles, such as Valor of Quinn.;Demacia, Azurite Eagle, Tuskvores, Quinn
Demacia;Les Ourslaireaux sont de grands mammifères omnivores qui vivent dans les forêts de Demacia. Leur nom provient de leur apparence mixte. Leur couleur de fourrure ressemble à celle d'un blaireau, tandis que la forme et la taille de leur corps leur donnent une stature d'ours. Certains rangers maîtres-bêtes demaciens ont domestiqué des Oursblaireaux, qui sont de compagnons fidèles pendant les chasses et les missions de reconnaissance.;Badgerbears are large mammalian omnivores that live in the forests of Demacia. Their name stems from their mixed appearance. Their fur color resembles that of a badger, while their body shape and size give them a bears stature. Some Demacian ranger beastmasters have domesticated badgerbears, which work well as loyal companions during hunts and scouting missions.;Demacia, Badgerbear
Demacia;Un Bellswayer est une créature fière et céleste originaire des montagnes d'Argent, les belles cloches carillonnantes du Bellswayer inspirent et obligent les autres esprits à les assister. Bien qu'ils soient facilement surpris, les bellswayers reprennent rapidement une posture calme et royale.;Bellswayer is a proud, celestial creature native to the Argent Mountains, the Bellswayer's beautiful chiming bells inspire and compel other sprites to attend them. Though they startle easily, bellswayers are just as quick to resume a composed and regal posture.;Demacia, Bellswayer
Demacia;Les Fleetfeathers sont des prédateurs aviaire qui sont de proches parents des rapaces à ailes argentées, bien qu'ils partagent une apparence d'aigle avec les Azurites. Ils sont bien plus petits que à leurs cousins. Cependant, ces oiseaux conservent toujours un instinct de prédateur agressif, attaquant les chevaux et les humains qui se rapprochent de leur environnement. Les trackers Fleetfeather sont souvent utilisés par l'armée demacienne pour traquer les éclaireurs ennemis ou les bandits en fuite.;Fleetfeathers are an avian predator who is a close relative to the silverwing raptors, though share an eagle appearance with Azurites. There are way smaller size compared to their cousins. However, these birds still retain an aggressive predatory instinct, attacking horses and humans that get close to their surroundings. Fleetfeather trackers are often used by the Demacian military to hunt down enemy scouts or fleeing bandits.;Demacia, Fleetfeathers 
Demacia;Les Arbres de Pétricite sont des arbres ressemblant à des fossiles qui ont été magiquement modifiés par les Runes du Monde. Ils ont des capacités d'atténuation de la magie ainsi que la capacité d'absorber la magie. Hauts de plusieurs étages, ces arbres blancs et leurs feuilles jaunes sont aussi durs que la pierre. Les premiers colons de Demacia ont découvert une forêt pétrifiée qui peut dissiper la magie, et ont mélangé ce bois avec de la cendre et de la chaux dans le matériau résistant appelé Pétricite. De cette innovation, les murs de Demacia ont été établis. Le matériau utilisé par les Demaciens dans les murs défensifs, l'armée et la sécurité publique. Il est également utilisé dans l'architecture demacienne en raison de son aspect blanc et élégant. Cependant, ce sont des ressources limitées car les arbres ont cessé de pousser pour le moment.;Petricite Trees are fossilized-like trees that were magically altered by World Runes. They have magic-dampening abilities as well as the ability to absorb magic. Several stories high, these white trees and their yellow leaves are as hard as stone. The early settlers of Demacia discovered a petrified forest that can dispel magic, and mixed this wood with ash and lime into the resistant material that is called Petricite. From this innovation, the walls of Demacia were established. The material used by Demacians in defensive walls, military, and public security. It is also used in Demacian architecture due to its white and elegant appearance. However, they are a limited resources as the trees have stopped growing at the moment.;Demacia, PetriciteTree, WorldRunes, Petricite
Demacia;Les Rapaces aux Ailes Argentés sont des créatures ressemblant à des griffons originaires des hautes falaises du nord de Demacia, les rapaces sont des prédateurs rares et voraces connus pour attaquer les fermiers solitaires, et parfois même des convois armés de soldats. Néanmoins, des individus particulièrement exceptionnels ont fait un art de nouer des relations avec ces nobles bêtes, forgeant un tel lien que le rapace peut se laisser monter. Ces cavaliers servent dans l'armée demacienne, servant en tant qu’éclaireur, ou harcelant l'avancée ennemie. Les jeunes rapaces ont des plumes jaunes et bleu clair, avant de voir leur teinte argentée caractéristique apparaitre avec le temps.;The Silverwing Raptors are griffin-like creatures native to the high crags of northern Demacia, raptors are rare and voracious predators known to attack lone farmers, and occasionally even armed convoys of soldiers Nevertheless, particularly exceptional individuals have made an art of building rapport with these noble beasts, forging such a bond that the raptor may permit itself to be ridden. These riders serve in the Demacian military, scouting ahead or harassing the enemy advance. The young raptors egg hatchlings have yellow and light blue feathers, growing into their signature silvery hue with maturity.;Demacia, SilverwingRaptor
Demacia;Depuis le sanctuaire naturel de l'ouest de Valoran, une nouvelle nation ambitieuse a été construite, où tous étaient les bienvenus, quelle que soit leur position ou leur origine, tant qu'ils contribuaient au bien de l'ensemble. Pourtant, malgré les nobles débuts du pays, les idéaux de Demacia se sont tordus au fil des siècles. Ils sont cependant toujours animés par une cause commune pour répandre la bienveillance et l'ordre pour le bien de leur pays, tout en se vantant d'être les avant-gardes morales de Valoran, avec leur force, leur courage et leur unité. Les habitants ont cependant adopté des mesures apparemment draconiennes pour s'assurer que leur code moral reste le seul code par lequel on peut vivre et prospérer dans le royaume.;From the natural sanctuary of western Valoran an ambitious new nation was built, where all were welcome, regardless of station or background, so long as they contributed to the good of the whole. Yet despite the country's noble beginnings the ideals of Demacia has twisted over the centuries, they're still driven by a common cause to disseminate benevolence and order for the betterment of their country. While priding themselves as the moral vanguards of Valoran, with their strength, courage and unity. But have adopted seemingly draconian measures to ensure that their moral code remains the only code by which one may live and prosper within the kingdom.;Demacia
Demacia;Le crime sous toutes ses formes est sévèrement puni, ce qui engendre peu de délits au sein de Demacia. Certains détracteurs de Demacia (qui critiquent loin des confins de la nation) prétendent que cela est la preuve de son hypocrisie inhérente. Les demaciens contrent cet argument en soulignant que leur système judiciaire intègre la bienveillance et l'atténuation dans ses verdicts. Nul n'est puni sans un examen juste et équitable des circonstances en cause. Alors que d'autres peuvent continuer à critiquer la sévérité de la loi demacienne, les Demaciens maintiennent leurs convictions.;Crime in any form is harshly punished: there are no misdemeanors within Demacia. Some detractors of Demacia (who criticize far from the reaches of the nation) claim this as proof of its inherent hypocrisy. Demacians counter this argument by pointing out that their justice system incorporates benevolence and mitigation into its verdicts. No one is punished without fair and just consideration of the circumstances involved. While others may continue to criticize the harshness of Demacian law, the Demacians stand by their convictions.;Demacia
Demacia;La magie est particulièrement rare à Demacia et à la suite de la formation du pays, ses habitants ont été élevés dans des contes folkloriques sur les mages noirs et la magie puissante qui fut un temps, avait presque détruit le monde. Naturellement, ils se sont méfiés de son pouvoir sous toutes ses formes. Cette peur de la magie destructrice s'est même étendue à une forte méfiance envers les étrangers, ce qui a créé une nation insulaire qui refuse d'être inclusive avec le reste du monde. Les lois de la pierre stipulent que tout citoyen ou étranger est accepté à l'intérieur des murs de Demacia, mais un mage n'est pas autorisé à utiliser ses capacités magiques.;Magic is particularly rare in Demacia and in the wake of how the country was formed, its people have been raised on folk tales about dark mages and powerful magic that had almost destroyed the world. Naturally, they have become suspicious of its power in all forms. Where this fear in destructive magic has even extended to distrust in foreign people, which has flourished an insular nation that refuses to be inclusive with the rest of the world. The Laws of Stone dictate that any citizen or foreigner accepted inside the walls of Demacia if a mage is not allowed to use their magical abilities.;Demacia, RuneWar
