Name;Text;OriginalText;Tags
Demacia;"La nation cache une population de mages en constante augmentation en éliminant les individus magiques de la société publique. Ceux découverts avec ""l'affliction de la magie"" sont soit expulsés de Demacia, soit tournés vers les Traqueurs de Mages du Royaume, aussi appelés les Illuminateurs, un ordre secret chargé de protéger Demacia de la magie. Les malheureux tels que les mages rebelles sont placés dans des prisons sécurisées de Petricite spécialement conçues pour annuler les capacités magiques de ses prisonniers. Certains mages ont pu s'évader de prison après avoir réalisé les véritables capacités de Petricite telles que Sylas. Ces rebelles ont commencé une révolution de mages pour renverser le gouvernement anti-mage tyrannique. En raison d'actions plus strictes contre même les moins doués en magie, de nombreuses familles et communautés se sont également soulevées contre les lois et règlements archaïques de la nation.";"The nation hides an ever-growing mage population by removing magical individuals from public society. Those discovered with the ""affliction of magic"" are either expelled from Demacia, turned to the Kingdom's Mageseekers, or the Illuminators, secret orders tasked with guarding Demacia of magic. The unfortunate ones such as rebel mages are placed in secured Petricite prisons specially designed to nullify magical abilities of its prisoners. Some mages were able to break out from prison after realizing Petricites true capabilities such as Sylas. These rebels have started a mage revolution to topple the tyrannical anti-mage government. Due to stricter actions against even the least magically gifted, many families and communities have also risen up against the nations archaic laws and regulations";Demacia, Sylas
Demacia;L'architecture de Demacia s'inspire des Soeurs Ailées, principalement de La Protectrice, et se définit par son design simpliste et pourtant élégant. Les bâtiments ont de vastes cours, avec des jardins et des maçonneries somptueuses. D'autres bâtiments plus riches ont des intérieurs massifs, avec des sculptures faisant apparemment partie des fondations des bâtiments. De grands arbres vivants de pétricite sont abattus, mélangés à du calcaire pour créer un matériau de construction solide. La plupart des bâtiments sont renforcés par de la pétricite. Cette substance annulant la magie est utilisée comme un outil tout en renforçant la structure, est principalement utilisée pour éloigner toute magie de la zone où se trouve le bâtiment.;Demacian architecture is inspired by the Winged Sisters, mainly by The Protector, and is defined by its simplistic and yet elegant design. Buildings have vast courtyards, with lavished gardens and masonry. Other wealthier buildings have massive interiors, with sculptures seemingly part of the buildings foundation. Large Petricite living trees are cut down, mixed with limestone to create a strong construction material. Most buildings are reinforced by petricite. The magic-nullifying substance is used as a tool while strengthening the structure, is primarily used to ward of any magic from the area where building is located in.;Demacia, Kayle, Morgana
Demacia;Les ailes et les plumes sont presque aussi courantes dans l'art et l'architecture demaciens que les épées et les boucliers. Bien qu'elles rappellent les idéaux ambitieux de liberté et de transcendance, elles mettent également en évidence les liens du royaume avec les Rapaces aux Ailes Argentés, certains des chasseurs les plus impressionnants que l'on puisse trouver à Valoran.;Wings and featers are almost as common in Demacian art and architecture as swords and shields. While they recall the aspirational ideals of freedom and transcendence, they also highlight the kingdom's connections to the Silverwing raptors, some of the most impressive hunters found anywhere in Valoran.;Demacia
Demacia;"Le manuel du Traqueur de Mages est le guide principal que tous les traqueurs de mages doivent respecter. Une partie du texte à l'intérieur du livre va comme suit:\n\n- ""Il y a longtemps, la magie sauvage des Guerres runiques a mis tout Runeterra à genoux. Ainsi, notre ordre a été créé pour protéger notre royaume en le débarrassant de la magie, que ce soit à l'étranger ou à l'intérieur du royaume.""\n\n- ""Les objets arcaniques ont une intrigue indéniable. Mais il vaut mieux laisser ces objets de pouvoir entre les mains compétentes de nos experts, et loin de l'ignorance bien intentionnée de nos citoyens.""\n\n- ""Votre pétricite Graymark est votre principale protection contre la magie, un symbole de nos responsabilités et un rappel aux autres de notre autorité. Honorez-la par-dessus tout.""";"The Mageseeker handbook is the main guide that all mageseekers must abide by. Some of the text inside the book goes as followed:\n\n- ""Long ago, the wild magicks of the Rune Wars brought all Runeterra to its knees. Thus, our order was created to protect our kingdom by ridding it of magic, whether abroad or within.""\n\n- ""Arcane items have undeniable intrigue. But these objects of power are best left to the capable hands of our experts, and away from the well-meaning ignorance of our citizens.""\n\n- ""Your petricite Graymark is your primary safeguard against magic, a symbol of our responsibilities, and a reminder to others of our authority. Honor it above all else.”";Demacia
Demacia;Les Chercheurs de mages portent des demi-masques afin de signifier qu'ils agissent en qualité officielle au nom du trône de Demacia et non dans le cadre de leurs rôles sociaux ou militaires normaux. Cependant, n’ayant pas honte de ce qu'ils doivent faire pour protéger Demacia d’une incontrôlable magie, ils n'ont donc aucune raison de dissimuler leur identité.;Mageseekers wear half masks in order to signify they are acting under official capacity on behalf of the throne of Demacia and not under their normal social or military roles. However they are not ashamed of what they must do in order to keep Demacia safe from unchecked magic so they have no reason to conceal their identities.;Demacia
Demacia;La pétricite est un matériau absorbant la magie utilisé dans l'armée demacienne, elle est également utilisée dans l'architecture et les outils pour son apparence blanche et élégante. Les premiers colons de Demacia ont rencontré des forêts pétrifiées capables d'absorber la magie. En combinant la chaux, la cendre et l'écorce fossilisée d'arbres séculaires, ils ont créé un matériau résistant appelé Pétricite. Cette innovation a permis de construire les murs blancs de Demacia ou encore un colosse mobile de pétricite (Galio). Cependant, la pétricite n'est pas indestructible, et Noxus a des basilics (et Sion) assez gros pour assiéger la plupart des murs de la ville. La pétricite n'est pas infaillible. Lorsque la magie n'est pas correctement annulée par la pierre, elle peut s'écailler et se tordre en des formes non naturelles. La magie absorbée par la pétricite peut rester en sommeil pendant des années et a récemment été utilisée par Sylas lors de sa révolte. Les Traqueurs de Mages utilisent un élixir de pétricite pour réprimer une énorme partie magie de ses prisonniers à moyen risque.;The Petricite a magic-absorbing material used in Demacian military, it is also utilized in architecture and tools for its white, elegant appearance. The early settlers of Demacia encountered petrified forests that could absorb magic. Combining lime, ash and the fossilized bark from ancient trees, they created a resistant material called Petricite. With this innovation, the white walls of Demacia were established and eventually a mobile petricite colossus (Galio). However, Petricite is not indestructible, and Noxus have Basilisks (and Sion) big enough to besiege most city walls. Petricite is not infallible. When magic is not nullified properly by the stone it can cause it to flake and torque in unnatural shapes. The magic absorbed by Petricite can lay dormant for years, and was recently used by Sylas during his revolt. The Mageseekers use a Petricite elixir to quell tremendous magic in its mid-risk prisoners.;Demacia, Galio, Noxus, Sion
Demacia;"Une variante de Tellstones appelée ""King's Gambit"" est jouée dans Demacia. Il porte le nom d'un roi demacien Santon le Grand. Le roi Santon de Demacia a évité la guerre civile avec un jeu de Tellstones, sauvant des milliers de vies. Malgré la popularité du jeu à travers Runeterra, personne ne semble savoir d'où viennent les Tellstones. Il existe une variante de Tellstones jouée par l'Avant-garde Dauntless et ils l'utilisent pour régler les différends dans les rangs.";"A variant of Tellstones called ""King's Gambit"" is played in Demacia. It is named after a Demacian King Santon the Great. King Santon of Demacia avoided civil war with a game of Tellstones, saving thousands of lives. Despite the game's popularity across Runeterra, no one seems to know where Tellstones originated. There is a variant of Tellstones played by the Dauntless Vanguard and they use it to settle disputes within the ranks.";Demacia
Demacia;Les Kindred sont tous deux connus à Demacia, bien que l'Agneau soit nettement plus vénéré que le Loup. Lorsque le dernier moment viendra, il est dit qu'un vrai Demacien se tournera vers Agneau, acceptant sa flèche.;The Kindred are both known in Demacia, though Lamb is definitely more venerated than Wolf. When the final moment comes, it is said a true Demacian will turn to Lamb, taking her arrow.;Demacia, Kindred
Demacia;_Orphellum Mechanicals_ est une célèbre pièce de théâtre représentant Kindred. Les dualités d'une mort paisible et d'une mort violente. Avec la double menace de peste et de guerre sur les langues des protectorats voisins de Demacia, les drames de la mort faisaient fureur à l'époque de la célèbre actrice connue sous le nom de Magga.\nLa pièce commence avec une comédienne vêtue d'un masque d'Agneau. À la fin de la pièce, un personnage de jeune fille mord dans une pomme empoisonnée et est emmené par un acteur masculin dans un masque de loup après avoir refusé l'agneau.;Orphellum Mechanicals is a famous theatrical play of the Kindred, Lamb and Wolf. The dualities of a peaceful death and a violent one. With the twin threats of plague and war on the tongues of those in neighboring protectorates Demacia, death dramas were all the rage during the time of the famous actress known as Magga.\The play starts with an actress dressed with a Lamb mask. At the end of the play a maiden character bites on a poisoned apple and is taken away by a male actor in Wolf Mask after she refuses the Lamb.;Demacia, Kindred
Demacia;L'un des deux gardiens de la justice vénérés à Demacia. le Porteur de Justice, également connu sous le nom de La Protectrice (Kayle), est considéré comme le juge, le jury et le bourreau des injustes et des méchants. Peu de gens savent qu'il y avait deux Protecteurs Ailés de Demacia.;One of two guardians of Justice worshiped in Demacia. Bringer of Justice, also known as The Protector (Kayle) is seen as the judge, the jury, and the executioner of the unjust and wicked. Few know that there were two Winged Protectors of Demacia.;Demacia, Kayle
Demacia;L'un des deux gardiens de la Justice vénérés à Demacia est connu sous le nom de l'Épée de l'Ombre, La Dame Voilée ou La Voilée. Une paria dont les sombres explosions et la prédication de la rédemption l'ont conduite à l'exil. Même ainsi, certains Demaciens créent encore des totems à sa mémoire lorsqu'ils cherchent des conseils sur des questions de famille et de pardon. Elle est considérée comme celle qui donne la miséricorde, l'absolution, l'expiation de ceux qui souhaitent expier leurs péchés passés. Les Demaciens prient également pour que leurs défunts trouvent un passage sûr vers elle peu de temps après leur mort.;One of two guardians of Justice worshiped in Demacia is known as the Sword of Shadow, The Veiled Lady, or The Veiled One. A pariah whose dark outbursts and preaching of redemption led to her exile. Even so, some Demacians still create totems to her memory when seeking guidance on matters of family and forgiveness. She is seen as the one gives mercy, absolution, atonement of those that wish to atone for their past sins. Demacians also pray that their deceased find a safe passage to her shortly after death.;Demacia, Morgana
Demacia;Le Festival du Slayer est une célébration en l'honneur d'un chasseur de monstres (Poppy) qui a sauvé de nombreuses fermes et villages demaciens des wyvernes, des loups enragés et des bandits. Bien que ce guerrier vénéré ait choisi de rester anonyme, cela n'a pas empêché les villageois de célébrer ses exploits. Ce Slayer avait été repéré près de la ville d'Uwendale, laissant les premiers témoignages oculaires de son apparition. Pour commémorer la bravoure du héros, une statue de pierre a été érigée en son honneur.;"The Festival of the Slayer is a celebration to honor a monster hunter (Poppy) who saved numerous Demacian farms and villages from wyverns, rabid wolves, and bandits. Although this revered warrior had chosen to remain anonymous, that didn't stop the villagers from celebrating ""his"" deeds. This slayer had been spotted near the town of Uwendale, leaving the first eyewitness accounts of ""his"" appearance. To commemorate the hero's bravery a stone statue was erected in ""his"" honor.";Demacia, Poppy
Demacia;Demacia est une monarchie constitutionnelle, où le roi de Demacia est le chef de l'État et un conseil élu sert d'organe législatif. Alors que le roi est un dirigeant fort, il est tenu en échec au moins partiellement par le Conseil demacien. L'ancien roi de Demacia, Jarvan III (Jarvan Lightshield le Troisième), a travaillé avec ferveur avec le Conseil de Demacia pour s'assurer que le caractère sacré du royaume reste pur et vrai. Un roi sert non seulement de chef politique du pays, mais aussi de commandant en chef pour son armée. De nombreux territoires contrôlés par le Royaume sont connus sous le nom de Protectorats.;Demacia is a constitutional monarchy, where the King of Demacia serves as the head of state and an elected council serves as the legislative body. While the king is a strong ruler, he is kept in check at least partially by the Demacian Council. The former King of Demacia, Jarvan III (Jarvan Lightshield the Third), worked earnestly with the Demacian Council to ensure that the sanctity of the kingdom remained pure and true. A king serves not only as the political leader of the country, but also as the commander-in-chief of its military. Numerous territories controlled by the Kingdom are known as the Protectorates.;Demacia
Demacia;Depuis le règne de Jarvan Ier, il n'y a pas eu de tentative de coup d'État ou de rébellion d'aucune sorte à Demacia. Cela a changé lorsque le mage connu sous le nom de Sylas de Dregbourne a commencé sa révolution juste après son évasion de prison, ce qui a peut-être conduit à la mort de Jarvan III. L'actuel et seul prochain candidat au trône est Jarvan IV, qui sera bientôt sacré roi.;Since the rule of Jarvan I, there has not been an attempted coup or rebellion of any kind in Demacia. That changed when the mage known as Sylas of Dregbourne started his revolution right after his prison escape which may have led to the death of Jarvan III. The current and only person next in line for the throne is Jarvan IV, soon to be King Jarvan.;Demacia, Sylas, Jarvan
Demacia;En tant que monarchie, Demacia est gouvernée par diverses familles royales, réglementant la nation principalement en tant que membres du Conseil de Demacia. Alors que de nombreuses maisons nobles ont régné pendant des générations, elles sont traitées comme n'importe quel autre citoyen en vertu des lois strictes de la nation et n'en sont pas exemptées. Ils peuvent même être traités plus durement par la loi car ils sont censés servir d'exemples brillants de la façon dont les citoyens demaciens devraient se conduire, en public et en privé.;As a monarchy, Demacia is governed by various royal families, regulating the nation primarily as members of the Demacian Council. While many of the Noble Houses have ruled for generations, they are treated as any other citizen under the nation's strict laws and are not exempt from them. They may even be treated more harshly under the law as they are meant to serve as shining examples of how Demacian citizens should conduct themselves, publicly and privately.;Demacia
Demacia;Les maisons nobles les plus connues sont :\n- Buvelle, connue pour son mécénat des arts musicaux. Comprend Sona.\n- Crownguard, une famille parangon du service demacien. Comprend Lux et Garen.\n- Durand, famille du célèbre ancêtre Durand, créateur de Galio.\n- Laurent, connu pour sa longue lignée de duellistes d'élite et d'amateurs de belles choses. Comprend Fiora.\n- Lightshield, la famille royale. Comprend Jarvan et Xin Zhao.\n- Spiritmight, connu pour être la force politique la plus influente de Demacia.\n- Vayne, une maison où les parents de Shauna Vayne (le personnage lol) ont été assassinés par une légendaire femme cornée (Evelynn).;The most known noble houses are :\n- Buvelle, known for their patronage of the musical arts. Includes Sona.\n- Crownguard, a paragon family of Demacian service. Includes Lux and Garen.\n- Durand, family of the famous ancestor Durand, créateur de Galio.\n- Laurent, known for its long line of elite duelists and lovers of beautiful things. Includes Fiora.\n- Lightshield, the royal family. Includes Jarvan and Xin Zhao.\n- Spiritmight, known for being the most influential political forces in Demacia.\n- Vayne, a house where the parents of Shauna Vayne (the lol character) were murdered y a fabled horned woman (Evelynn).;Demacia, Sona, Lux, Garen, Galio, Fiora, Jarvan, XinZhao, Vayne, Evelynn
Demacia;Les magistrats sont les dirigeants provinciaux de Demacia. Ils sont chargés d'appliquer la règle demacienne dans les villes ou les villages en dehors de la capitale.\n\nGiselle, l'actuelle magistrate de Fossbarrow, a fait sauver son fils Luca par Garen et Lux d'une possession démoniaque.;Magistrates are the provincial rulers of Demacia. They are tasked to enforce Demacian rule in cities or villages outside the capital.\n\nGiselle, the current Magistrate of Fossbarrow, had her son Luca was saved by Garen and Lux from a demonic possession.;Demacia, Garen, Lux, Nocturne
Demacia;Les couleurs de Demacia sont le bleu, le blanc et l’or.;Demacian colors are blue, white and gold.;Demacia
Demacia;Dans League of Legends, Demacia représente le rang Challenger.;;Demacia
