Name;Text;OriginalText;Tags
Freljord;Les Avarosan sont ceux qui sont fidèles à Ashe. Pendant que d'autres se battent, Ashe travaille jour et nuit pour établir une alliance unique dans tout Freljord. Cette tribu est une agglomération de plusieurs tribus progressistes qui croient en la diplomatie à travers les enseignements d'Avarosa. Ils habitent principalement dans les régions légèrement plus chaudes et de nombreuses colonies sous leur bannière sont agraires. Bien que les méthodes d'Ashe soient pacifiques, elle est toujours soutenue par une armée puissante et engagée. Ashe a de nombreux alliés à ses côtés tels que : Anivia, Braum, Gragas et Tryndamere.;The Avarosan are those whom are loyal to Ashe. While others war, Ashe works day and night to establish a single alliance throughout the Freljord. They are an agglomeration of progressive tribes that believe in diplomacy through the teachings of Avarosa. They dwell mostly in the slightly warmer regions, and many settlements under their banner are agrarian. Though Ashe's methods are peaceful, she is still backed by a powerful and committed army. Ashe has many tribes allied with her and several people such as: Anivia, Braum, Gragas, and Tryndamere.;Freljord, Avarosan, Ashe, Anivia, Braum, Gragas, Tryndamere
Freljord;La tribu de la Griffe d'hiver est dirigée par la féroce Sejuani. Sejuani souhaite conquérir Freljord par la force absolue. À ses yeux, Freljord est un endroit où seuls les plus forts méritent de prospérer. Guerriers et traditionalistes, ils recueillent de la nourriture et des provisions dans les hautes plaines, les forêts et les voies navigables du nord pendant l'été. Pendant les mois d'hiver, ils survivent en faisant des raids vers le sud sur les mers couvertes de glace. Lors des raids de Sejuani, ses guerriers permettent aux fidèles de vivre sous sa bannière pendant qu'ils pillent les tribus les plus faibles, les laissant sans moyens de subvenir à leurs besoins. Une fois son travail terminé, seuls les puissants resteront à Freljord. Sejuani a de nombreux alliées à ses côtés tels que : Olaf, Udyr et Volibear.;The Winter's Claw tribe is led by the ferocious Sejuani. Sejuani wishes to conquer the Freljord through absolute strength. In her eyes, the Freljord is a place where only the strong deserve to prosper. Warlike and traditionalist, they gather food and supplies from the high plains, forests, and northern waterways during the summer. In winter months, they survive by raiding southwards over the ice-covered seas. As Sejuani raids, her warriors allow the stalwart to live under her banner while they pillage the weaker tribes, leaving them without the means to sustain themselves. Once her work is done, only the mighty will be left in the Freljord. Sejuani has many tribes allied with her and several people such as: Olaf, Udyr, and Volibear.;Freljord, WintersClaw, Sejuani, Olaf, Udyr, Volibear
Freljord;Les Guardiens du Givre vivent cachés sous un hiver éternel, au plus profond des ruines de l'ancien Freljord. Ils vivent parmi les ruines antiques à l'extrême nord, protégeant leur chef Lissandra alors qu'elle veille sur l'Abîme Hurlant. Un culte entouré de secret, les guardiens du givre archivent toute l'histoire archaïque de Freljords. Bien qu'apparemment pacifique, la vérité sur l'allégeance du Guardien du givre est bien plus troublée. Le monde avait oublié le terrible ennemi qui régnait sur Freljord il y a longtemps et fut jeté dans les profondeurs de l'Abîme hurlant après une longue et brutale bataille. Et ce jour encore, Lissandra tient les Veilleurs à distance et complote pour régner sur tout Runeterra. Même ainsi, les missionnaires et les guérisseurs du culte sont courants dans tout Freljord. Les trolls et leur roi, Trundle, se sont alliés à Lissandra, alors que Nunu vivait temporairement parmi les guardiens du givre.;The Frostguard dwell hidden beneath an eternal winter, deep in the ruins of the ancient Freljord. They live among the ancient ruins to the far north, protecting their leader Lissandra as she watches over the Howling Abyss. A cult shrouded in secrecy, the Frostguard archive of all Freljords archaic history. Though seemingly peaceful, the truth of the Frostguard's allegiance is far more disturbed. The world had forgotten the terrible enemy that ruled the Freljord long ago and was cast into the depths of the Howling Abyss following a long and brutal battle. And now, whilst the ignorant sleep, Lissandra keeps the Watchers at bay and plots to rule over all of Runeterra. Even so, missionaries and healers from the cult are common throughout the Freljord. The trolls and their king, Trundle, have allied themselves with Lissandra, while Nunu temporarily lived among the Frostguard.;Freljord, Frostguard, Lissandra, Trundle, Nunu
Freljord;Les Ursines, ou Les Égarées, habitent la plupart des régions nord de Freljord. Entièrement composés d’esprits nomades, les Ursines sont des métamorphes humains qui servent le Grand Esprit de l'Ours connu sous le nom de Volibear. Les serviteurs de Volibear sont entièrement dévoués à la volonté et à la cause de leur maître. Alors que certains conservent leur apparence humaine, la plupart se métamorphosent de manière permanente en approximations grotesques d'animaux sauvages et d'autres types de monstres. La tribu existe depuis que les humains se sont installés à Freljord, toujours craints et respectés par les habitants de ces terres. Alors que les humains et les sublimés n'ont pas été en mesure de vaincre cette tribu, la griffe de l'hiver Sejuani et Udyr ont pu former une alliance temporaire avec l'Ursine pour combattre d'autres tribus plus importantes telles que les Avarosan et Frostguard. Seuls quelques êtres sont capables d'égaler la puissance de Volibear, comme le Grand Esprit du Bélier connu sous le nom d'Ornn.;The Ursine, or The Lost Ones, dwell in the north most parts of the Freljord. Entirely consisted of Spirit Walkers, the Ursine are human shapeshifters who serve the Great Spirit of the Bear known as Volibear. Volibears servants are entirely devoted to their masters will and cause. While some retain their human appearance, most permanently shapeshift into grotesque approximations of wild animals and other types of monsters. The tribe has existed for as long as humans settled the Freljord, ever feared and respected by the lands inhabitants. While humans and Iceborn alike have not been able to defeat this tribe, the Winter's Claw Sejuani and Udyr have been able to form a temporary alliance with the Ursine to fight other larger tribes such as the Avarosan and Frostguard. Only a few beings are able to match Volibears might, such as the Great Spirit of the Ram known as Ornn.;Freljord, Ursine, Volibear, Sejuani, Udyr, Ornn
Freljord;La tribu précédente de Nunu, les Notai, étaient une tribu nomade qui voyageait à travers le Freljord, s'installant à un endroit donné jusqu'à l'arrivée de l'hiver, où ils migraient vers les terres plus chaudes du sud. Choisissant un mode de vie non violent, la culture de cette tribu tournait autour de la collecte de contes et de mythes de différents coins de Freljord. La tribu avait une profonde vénération pour le demi-dieu Anivia, trouvant réconfort et conseils grâce à ses enseignements. L'état actuel de la tribu est inconnu, mais le groupe de caravanes de Nunu a été décimé par une attaque surprise de guardiens du givre, car les Notai abritaient d'anciens mystères des terres de Freljord que Lissandra veut garder secrets.;Previously Nunu's tribe, the Notai were a nomadic tribe that travelled across the Freljord, settling at a given place until the coming of winter when they would migrate to warmer southern lands. Choosing a non-violent lifestyle, the tribes culture revolved around gathering tales and myths from different corners of the Freljord. The tribe had a deep veneration for the Demi-God Anivia, finding solace and guidance from her teachings. The current state of the tribe is unknown, however Nunu's caravan group was decimated by a surprise Frostguard attack, due to the Notai harboring ancient secrets of the land that Lissandra wants to keep a secret.;Freljord, Notai, Nunu, Anivia, Lissandra
