Name;Text;OriginalText;Tags
Noxus;Le vétéran de la guerre Quilleta Varn, intendant de Baslich à l'époque, s'est rebellé contre Noxus, forçant la Main de Noxus (Darius, l'ami d'enfance et ex-amant de Quilleta) lui-même à venir dans la ville, avec Draven et le Warmason Tamara. Contre l'avis de Tamara, Draven dirige une force contre la ville, qui est repoussée par des archers et une bombe à poudre.\n\nAprès la défaite, Darius se rend à Blackrock Mere, un lac qui lui rappelle son temps avec Quilleta, il l'a fait en sachant qu'un assassin serait prêt à le tuer, et a donc amené Draven caché avec lui.\n\nDe retour à Basilich avec la tête de l'assassin, Darius et Draven affrontèrent Quilleta et son commandant en second Invetia Varn. Il est révélé que Decius, le fils de Quilleta, est mort dans la campagne contre Freljord par l'appel aux armes de Darius. Une discussion surgit sur la façon dont Noxus doit conquérir alors qu’aucune ville ne puisse se rebeller sans en payer le prix.\n\nSoudain, des navires de Vindor sont vus au loin, Quilleta affirme que l'intendant Amenesce se tient à ses côtés et amène ses guerriers pour l'aider, mais en raison des forces des légions trifariennes sur Vindor, Amenesce a trahi Quilleta et venait en fait aider Darius. À court d'options, Quilleta essaie de dire à Darius que Decius était aussi le fils de Darius. Invetia Varn, sa propre fille (et laissé entendre qu'elle est la fille de Darius par l'interaction de Swain), la tue avant qu'elle n'ait fini, devenant l'intendante de Basilich et mettant fin à la rébellion.;The war veteran Quilleta Varn, steward of Baslich at the time, rebelled against Noxus, forcing the Might of Noxus (Darius, Quilleta's childhood friend and ex-lover) himself to come to the city, together with Draven and the Warmason Tamara. Against Tamara's advice Draven leads a force against the city, which is held back by archers and a gunpowder bomb.\n\nAfter the defeat Darius goes to Blackrock Mere, a lake that reminded him of his time with Quilleta, he did so knowing an assassin would be ready to kill him, and so brought Draven hidden with him.\n\nGoing back to Basilich with the assassin's head, Darius and Draven faced Quilleta and her second-in-command Invetia Varn. It is revealed that Decius, Quilleta's son, died in the campaign against Freljord by Darius's call to arms. A discussion arises about how Noxus must conquer and no city can rebel without paying the price.\n\nSuddenly ships from Vindor are seen in the distance, Quilleta affirms that Steward Amenesce stands at her side and is bringing his warriors to help her, but due to Trifarian Legions forces on Vindor, Amenesce betrayed Quilleta and was actually coming to help Darius. Running out of options, Quilleta tries to tell Darius that Decius was not only her son, but also Darius'. Invetia Varn, her own daughter (and hinted to also be Darius' by Swain's interaction), kills her before she finishes, becoming steward of Basilich and ending the rebellion.;Noxus, Darius, Draven
Noxus;Situé au cœur de ce qui deviendra plus tard l'empire noxien, le Bastion immortel a été construit par un redoutable sorcier (Mordekaiser) à une époque lointaine. Pourtant finalement assiégée et conquise par une confédération de tribus barbares qui feront de la place forte leur nouvelle capitale. À l'intérieur des murs de la forteresse, les rues et les ruelles sont étroites et sinueuses, conçues pour étouffer et frustrer toute force d'attaque qui a réussi à pénétrer les défenses extérieures de la forteresse. Les toits sont plats et crénelés, comme les remparts d'un château, permettant aux soldats d'en haut de dominer tout ennemi en dessous. Bien qu'elle soit loin d'être aussi vierge en apparence que la Grande Cité de Demacia, la ville est la représentation visuelle de la nature austère de l'empire. De nombreuses maisons nobles sont implantées dans la capitale, comme la Maison Du Couteau. La ville est également le siège de l'énigmatique cabale de la Rose Noire.;Situated in the heartlands of what would later become the Noxian empire, the Immortal Bastion was built by a dreaded sorcerer (Mordekaiser) in a far distant age. Yet eventually besieged and conquered by a confederation of barbarian tribes who would make the stronghold their new capital. Within the stronghold's walls, the streets and alleyways are narrow and twisting, designed to stifle and frustrate any attacking force that managed to penetrate the fortress outer defenses. The rooftops are flat and crenelated, like the battlements of a castle, allowing soldiers above to dominate any enemy below. While nowhere near as pristine in appearance as the Great City of Demacia, the city is the visual representation of the empire's austere nature. Many noble houses are located in the capital, such as House Du Couteau. The city is also the headquarters of the enigmatic Black Rose cabal.;Noxus, Mordekaiser
Noxus;**Lieux iconiques à Noxus 1/2**\n\n     - **Mortoraa** : Traduit en Porte de Fer, c’est un petit quartier du Bastion Immortel, connu pour être l'un des quartiers les plus riches ainsi que pour abriter le mystérieux et mondain Vladimir. Contrairement à de nombreux autres quartiers qui sont généralement exigus, les rues de Mortoraa sont luxueuses et confortablement spacieuses. Cependant, la nuit, il a la réputation d'être le quartier le plus menaçant car les rues ne sont jamais éclairées par des torches ou des lanternes.\n\n    - **Bastion Center Tri-Towers** : Situé au centre du Bastion, c'est un endroit interdit à l'ordre des Trifarix car il n'est pas sous leur contrôle, et quiconque tente d'y aller doit donc être un ennemi de Noxus. C'est peut-être le quartier général de la Rose Noire.\n\n     - **Sanctuaire du Loup** : Une haute tour à plusieurs niveaux avec des côtés ouverts, butant contre les anciens remparts sud du Bastion Immortel. Chaque niveau de la tour est soutenu par trois piliers de pierre sombre. Au centre de la tour, qui s'élève à près de cinquante pieds de haut, se trouve une statue massive en obsidienne d'un loup assis.\n\n     - **Stairs of Triumph** : Un long escalier ininterrompu menant à la salle d'audience. En allant à la salle d'audience, une paire de légionnaires vêtus d'acier sombre se tiennent en sentinelle tous les douze pas.\n\n     - **Chambre d'audience** : Une ancienne salle du trône caverneuse, assez grande pour abriter plus d'un millier de pétitionnaires. Alors que Boram Darkwill était autrefois perché sur le trône, les Trifarix qui dirigent désormais Noxus sont assis à une simple table de marbre au pied de la plate-forme surélevée du trône pour discuter de l'avenir de Noxus et entendre les pétitions des dirigeants de ses régions.;**Location iconiques à Noxus 1/2**\n\n    - **Mortoraa**: Translated into Iron Gate, is a small district within the Immortal Bastion, known for being one of the wealthiest neighborhoods as well as home to the mysterious socialite, Vladimir. Unlike many other districts which are typically cramped, the streets in Mortoraa are luxurious and comfortably spacious. However, at night it has a reputation as the most ominous district for the streets are never illuminated with torch-light or lanterns.\n\n   - **Bastion Center Tri-Towers**: Located at the center of the Bastion, it is a place forbidden by the order of the Trifarix due to it not being under their control, and anyone who tries to go there must therefore be an enemy of Noxus. It is possibly the headquarter of the Black Rose.\n\n    - **Shrine of the Wolf**: A tall, multi-tiered tower with open sides, butting up against the old southern bulwarks of the Immortal Bastion. Each level of the tower is held aloft by three pillars of dark stone. In the center of the tower, looming almost fifty feet high, is a massive obsidian statue of a seated wolf.\n\n    - **Stairs of Triumph**: A long unbroken flight of stairs leading to the Audience Chamber. Going to the Audience Chamber, a pair of liveried Legionnaires clad in dark steel stand sentinel every twelve steps.\n\n    - **Audience Chamber**: An old cavernous throne room, large enough to house over a thousand petitioners. While Boram Darkwill once perched on the throne, the Trifarix who now lead Noxus sit at a simple marble table at the foot of the throne's raised platform to discuss the future of Noxus and hear petitions from leaders of its regions.;Noxus, Vladimir
Noxus;**Lieux iconiques à Noxus 2/2**\n\n     - **Mémorial de Sion** : Ce mémorial et ce tombeau sont dédiés à Sion, un héros de guerre noxien célébré comme l'assassin du roi demacien Jarvan Ier. Il a ensuite été utilisé pour contenir la forme ressuscitée de Sion avant Swain, avec l'aide de la Rose noire, a réussi à le contrôler en utilisant le sang de Jarvan IV. L'état actuel de ce mémorial est inconnu, bien que l'ancien homme qui y était logé serve à nouveau Noxus à contrecœur.\n\n     - **Bidonvilles** : L'étalement des habitations construites au-delà des murs marqués par les batailles de la capitale noxienne où de nombreuses personnes vivent dans une pauvreté abjecte et où la mort est monnaie courante. Les Tally-men de Kindred entaillent souvent leurs bâtons et leurs corps nus dans les hospices.\n\n     - **The Fleshing Arena** : Noxus est réputé pour un festival appelé The Fleshing, bien qu'on ne sache pas si cela continue encore. C'est un événement de gladiateurs avec une tournure cruelle : à mesure qu'un combattant gagne ses matchs, le nombre d'adversaires qu'il combat simultanément, généralement d'autres prisonniers de guerre, augmente. Cela signifiait la mort éventuelle pour chaque concurrent, mais aussi une gloire sans précédent. Xin Zhao et Alistar sont tous deux des survivants du spectacle, Xin Zhao détenant le record du plus grand nombre d'adversaires vaincus.\n\n     - **Enclave de Zagayah** : Enclave côtière habitée par des Shurimans qui ont rejoint l'empire sur des pavillons de tentes. Il est connu pour ses chants de marche dans le désert.;**Locations iconiques à Noxus 2/2**\n\n    - **Sion's Memorial**: This memorial and tomb is dedicated to Sion, a Noxian war hero celebrated as the killer of the Demacian king Jarvan I. It was later used to contain the resurrected form of Sion before Swain, with the aid of the Black Rose, was successfully able to control him by the use of Jarvan IV's blood. The current state of this memorial is unknown, though the former man once housed in it unwillingly serves Noxus once more.\n\n    - **Slums**: The sprawl of dwellings built beyond the battle scarred walls of the Noxian capital where many people live in abject poverty and death is commonplace. Tally-men of Kindred often notch their staffs and bare bodies from the almshouses.\n\n    - **The Fleshing Arena**: Noxus has been renowned for a festival called The Fleshing, though it is unknown if this still continues. It is a gladiatorial event with a cruel twist: as a fighter wins their matches, the number of opponents they fight simultaneously, generally other prisoners of war, increases. This meant eventual death for every contender, though also unparalleled glory. Both Xin Zhao and Alistar are survivors of the spectacle, with Xin Zhao holding the record for defeating the most opponents.\n\n    - **Zagayah Enclave**: Coastal enclave inhabited by Shurimans who joined the empire on tented pavilions. It is known for it's desert marching songs.;Noxus, Sion, Jarvan, XinZhao, Alistar
Noxus;"**Lieux iconiques au nord de Noxus 1/2** :\n\n    - **Plaine de Dalamor** : Située à l'extrémité nord de Noxus, de nombreux voyageurs ont perdu la vie dans ce désert impitoyable. En raison du climat poussiéreux et peut-être aussi de la présence d'un certain yordle meurtrier (Kled) et de son drakalops mythique (Skaarl), la plupart des Noxiens évitent de voyager dans la région. Le seul village peuplé sur des centaines de kilomètres étant le village de Drugne. Il s’agit d’une ville isolée au nord des plaines de Dalmor et au sud-est des montagnes Ironspike.\n\n    - **Montagnes Ironspike** : Il s'agit d'une chaîne de montagnes relativement petite située au sud-est. Noxus a un territoire ici, dans le Delverhold.\n\n        - **Delverhold** : Entre Noxus et la toundra froide de Freljord se trouve Delverhold : Une forteresse installée au pied des montagnes Ironspike où elle a prospéré grâce à la richesse de l'or et du minerai de fer extraits des montagnes. C'était à l'origine un royaume de sa propre indépendance, jusqu'à ce que l'empire de Noxus empiète il y a environ 87 ans. Craignant d'être anéanti, le roi de Delverhold renonça à son autorité et jura fidélité à l'empereur étranger. Maintenant, ses habitants travaillent sans relâche pour fournir à Noxus des armures et des armes fabriquées avec le fer qu'ils extraient ; et en retour, ils ne sont jamais exigés de se battre pour l'empire.\n\n    - **La maison d'Hastur** : Ancienne demeure de la famille Hastur. Il a depuis brûlé en raison des capacités incontrôlées d'Annie.";"**Locations iconiques au nord de Noxus 1/2** :\n\n    - **Dalamor Plain**: Located at the northern edge of Noxus, many travelers have lost their lives in this unforgiving wasteland. Due to the dusty climate and perhaps also the presence of a certain murderous yordle (Kled) and his mythic drakalops (Skaarl), most Noxians avoid traveling through the area, with its only populated settlement for hundreds of miles being the village of Drugne. It is an isolated town north of the Dalmor Plains and southeast of the Ironspike Mountains.\n\n    - **Ironspike Mountains**: They are a relatively small mountain range located in the southeast. Noxus has territory here, in the Delverhold.\n\n        - **Delverhold**: Between Noxus and the cold tundra of the Freljord lies Delverhold: A fortress settled at the foot of the Ironspike Mountains where it has prospered from the wealth of gold and iron ore quarried from the mountains. It was originally a kingdom of its own independence, that is until the empire of Noxus encroached about 87 years ago. In fear of annihilation, the Delverhold king relinquished his authority and swore loyalty to the foreign emperor. Now its people work endlessly to supply Noxus with armor and weapons crafted with the iron they mine; and in turn, are never drafted to fight for the empire.\n\n        - **Hastur's Home**: Former home of the Hastur family. It has since burned down due to Annie's Annie's uncontrolled abilities.";Noxus, Kled, Annie
Noxus;**Lieux iconiques au nord de Noxus 2/2** :\n\n    - **Kimir** : Une cité minière noxienne au nord de Valoran. La ville est actuellement dirigée par l'intendant Colm Onren et est le principal exportateur de granit noxien dans le nord.\n\n        - **Cimetière de Kimir** : Le cimetière de Kimir est situé juste à l'extérieur de la ville. Ses sépultures sont ornées de pierres tombales et de statues à l'effigie des défunts.\n\n        - **Carrières de Kimir** : La plus ancienne carrière de Kimir était inégalée dans le nord. Elle était nichée entre un trio de hauts contreforts, la ziggurat inversée égalant doucement leur hauteur.\n\n    - **Urtis** : Une colonie de la frontière nord de Noxus. C'était auparavant son propre royaume indépendant jusqu'à ce que son roi soit tué par Darius.;**Locations iconiques au nord de Noxus 2/2** :\n\n    - **Kimir**: A Noxian mining city in northern Valoran. The city is currently led by Steward Colm Onren and is the leading exporter of Noxian granite in the north.\n\n        - **Kimir's Graveyard**: Kimir's graveyard is located just outside of the city. Its burials are adorned with gravestones and statues in the likenesses of the deceased.\n\n        - **Kimir's Quarries**: Kimir's oldest quarry was unequaled in the north. It was nestled between a trio of high foothills, the inverted ziggurat slowing biting into their height.\n\n    - **Urtis**: A northern frontier settlement of Noxus. It was previously its own independent kingdom until its king was killed by Darius.;Noxus, Darius
Noxus;**Lieux iconiques à l'est de Noxus** :\n\n    - **Bloodcliffs** : Construit dans les falaises près d'un estuaire, Bloodcliff est voisin du Bastion immortel et de Basilich sur la côte est de Valoran. Le chef actuel de la ville est Steward Hovri IV.\n\n    - **Drakkengate** : Le chef actuel de la ville est Steward Algor Nimchi. Il contrôle Noxus depuis la campagne Draken, menée par Kled. Son exportation la plus connue est ses sacs de boue (probablement utilisé pour confectionner des briques).\n\n    - **Drekan** : La colonie la plus proche du Bastion immortel.\n\n    - **Khom** : Un village où Ryze est né, ce village a été complètement anéanti pendant les guerres runiques.;**Locations iconiques à l’est de Noxus** :\n\n    - **Bloodcliffs**: Built into the cliffs near an estuary, Bloodcliff neighbors the Immortal Bastion and Basilich on the eastern coast of Valoran. The city's current leader is Steward Hovri IV.\n\n    - **Drakkengate**: The city's current leader is Steward Algor Nimchi. It has been in control of Noxus ever since the Draken campaign, lead by Kled. Its most well-known export is its fine mudpacks (for bricks perhaps).\n\n    - **Drekan**: The closest settlement to The Immortal Bastion.\n\n    - **Khom**: A village where Ryze was born, this village was completely obliterated during the Rune Wars.;Noxus, Kled, Ryze
Noxus;**Lieux iconiques au sud de Noxus 1/3** :\n\n     - **Monts d'Argent** : Une vaste chaîne de montagnes située dans la partie sud-ouest de Valoran. Noxus contrôle une petite partie de la chaîne de montagnes sur ses parties sud-est et sud-ouest. Son littoral a conquis les colonies noxiennes de Glorft, Kilgrove, Trevale. La chaîne de montagnes borde les montagnes Varju à l'est et les portes du deuil à l'ouest.\n\n         - **Portes du deuil** : Elles sont situées dans la pointe sud-ouest de Noxus et au centre de Valoran. Elles ont été utilisés pour protéger les terres voisines de l'invasion noxienne avant leur récente chute. Elles sont également situés à l'ouest de Hvardis. Les Portes sont le lieu des premières batailles entre Demacia et Noxus. Dans les temps modernes, il a été repris par la Légion Trifarian.\n\n         - **Glorft** : Situé au sud des Monts d'Argent sur la côte. On ne sait pas si cette ville est sous le contrôle de Noxus mais c'était le lieu de l'Assaut sur Glorft, dirigé par Kled.\n\n         - **Hvardis** : Une ville qui était située au bord des Montagnes d'Argent près des Portes du Deuil. Il a depuis été décimé par Sion sur ordre de Swain pour décourager et favoriser la rébellion des colonies conquises.\n\n         - **Kilgrove** : Situé au sud des Montagnes d'Argent sur la côte, Kilgrove est actuellement dirigé par Steward Dauvin, qui semble avoir remplacé son prédécesseur Thomark assez récemment. Son principal produit d'exportation est le cèdre de Kilgrovian.\n\n         - **Trevale** : Un village agricole à la limite ouest du territoire noxien. Kled faisait partie du premier parti Noxiis qui a saccagé le village. Riven est né et a grandi ici.;**Locations iconiques au sud de Noxus 1/3** :\n\n    - **Argent Mountains**: A vast mountain range located in the southwestern part of Valoran. Noxus controls a small portion of the mountain range on its south-eastern and south-western parts. Its coastline has Noxian conquered settlements of Glorft, Kilgrove, Trevale. The mountain range borders close to the Varju mountains on the east and the Gates of Mourning on the west.\n\n       - **Gates of Mourning**: They are located in the southwestern tip Noxus and central Valoran. They were used to guard the neighboring lands from Noxian invasion before their recent fall. They are also located west of Hvardis. The Gates are the location of the first battles between Demacia and Noxus. In modern times it was retaken by the Trifarian Legion.\n\n        - **Glorft**: Located south of the Argent Mountains on the coast. It is unknown if this city is under control of Noxus but it was the location for the Assault on Glorft, led by Kled.\n\n        - **Hvardis**: A city that was located at the edge of the Argent Mountains near the Gates of Mourning. It has since been decimated by Sion as ordered by Swain to discourage and further rebellion from conquered settlements.\n\n        - **Kilgrove**: Located south of the Argent Mountains on the coast, Kilgrove is currently led by Steward Dauvin, who seems to have replaced his predecessor Thomark quite recently. Its primary export is Kilgrovian cloudcedar.\n\n        - **Trevale**: a farming village on the western edge of Noxian territory. Kled was part of the initial Noxiis party that sacked the village. Riven was born and raised here.;Noxus, Kled, Sion, Swain
Noxus;**Lieux iconiques à Noxus 2/3** :\n\n     - **Fallgren** : L'une des deux îles situées au large de Basilich, la ville insulaire de Fallgren est sous le contrôle de Noxus depuis la bataille de Fallgren, prétendument menée par Kled. Actuellement, la ville est gouvernée par Steward Jeon. De nombreux tubes utilisés à Zaun ont été fabriqués ici par Hedicila Elastica.\n\n     - **La Grande Barrière** : Une grande chaîne de montagnes s'étendant à la limite sud-est de Valoran. C'était autrefois le théâtre de nombreuses batailles et de ruines éparpillées de villes et d'autres colonies détruites pendant les guerres runiques.\n\n        - **Basilich** : Située sur la côte est de Valoran se trouve la ville portuaire Basilich, qui a été intégrée à l'empire noxien il y a 32 ans après que les anciens de la ville se soient soumis au capitaine Cyrus et à son armée. De nos jours, Basilich fait partie des quelques villes qui ont tenté de se rebeller de l'emprise de Noxus. Plus récemment, lorsque l'intendant de la ville, Quilletta Varn, a perdu confiance en l'Empire et a déclenché une révolution pour l'indépendance. Pour des actes de défi, la ville a été assiégée personnellement par la Main de Noxus - Darius, qui a également été élevé dans les rues de Basilich en tant qu'orphelin. La rébellion en cours a pris fin après que l'intendant a été assassiné et remplacé par le commandant en second et la fille de Quilleta, Invetia Varn. La ville est bien connue pour ses peintures faites avec des toiles d'araignées.\n\n        - **Ironwater** : Située sur la côte de la Mer des Gardiens et à l'est de Trannit, Ironwater est actuellement gouvernée par l'intendant Arron. Son principal produit d'exportation est le vin de betterave.\n\n         - **Krexor** : Situé à l'est de Piltover, il est gouverné par Steward Lisabetya, le dernier d'une longue liste de gouverneurs. La ville est connue pour ses forgerons minotaures (espèce d'Alistar).;**Locations iconiques à Noxus 2/3** :\n\n    - **Fallgren**: One of two islands located off the coast of Basilich, the island city of Fallgren has been under control by Noxus ever since the Battle of Fallgren, purportedly spearheaded by Kled. Presently the city is governed by Steward Jeon. Many tubes used in Zaun have been made here by Hedicila Elastica.\n\n    - **The Great Barrier**: A large mountain range stretching at the edge of southeastern Valoran. It was once the sight of many battles and scattered ruins of cities and other settlements destroyed during the Rune Wars.\n\n       - **Basilich**: Located on the eastern coast of Valoran is the port city Basilich, which was integrated into the Noxian Empire 32 years ago after the city's elders submitted to Captain Cyrus and his army. Nowadays Basilich has been among a few cities that have attempted to rebel from the hold of Noxus. Most recently when the city's steward Quilletta Varn lost her faith in the Empire and sparked a revolution for independence. For acts of defiance, the city was besieged personally by the Hand of Noxus - Darius, who was also raised on the streets of Basilich as an orphan. The ongoing rebellion ended after the steward was murdered and replaced by Quilleta's second-in-command and daughter, Invetia Varn. The city is well known for its paintings made out of cobwebs.\n\n       - **Ironwater**: Located on the coast of the Guardian's Sea and east of Trannit, Ironwater is currently governed by steward Arron. Its primary export is beet wine.\n\n        - **Krexor**: Located east of Piltover, it is governed by Steward Lisabetya, the latest in a long list of governors. The city is known for its Minotaur smiths (Alistar's species).;Noxus, Kled, Darius, Alistar
