Name;Text;OriginalText;Tags
Noxus;**Maisons nobles de Noxus** :\n\n**Darkwill** - Boram, Keiran. Ancienne maison dirigeante de Noxus, avant le coup d'État de Swain et l'installation du Trifarix.\n\n**Granth** - Brannin, Hadrion. Une maison qui est restée fidèle à Darkwill pendant la révolution, ses membres les plus notoires ont été dépouillés de leurs biens et deux de ses membres ont ensuite été tués dans des tentatives de vengeance, l'une de ces tentatives étant liée aux intrigues de LeBlanc.\n\n**Du Couteau** - Marcus, Soreana, Cassiopeia, Katarina, Talon. Une maison d'assassins et d'espions. Son ancien mécène a joué un rôle déterminant dans la création du Trifarix tandis que sa matrone était membre de la Rose Noire.\n\n**Sassen** - Emet. Une maison dont le seigneur a été influencé par les charmes de Lady Elise et n'a jamais été revu.\n\n**Swain** - Jéricho. L'une des premières maisons nobles de Noxus. Après que Jéricho les ait dénoncé pour avoir comploté contre l'empire, la plupart sinon tous les autres membres de la maison ont été exécutés.\n\n**Tewain** - La maison noble chargée de gagner les faveurs de nombreux clans Minotaures avant de revendiquer Basilich. Sa matrone a été tuée par Alistar, qui a rejeté l'alliance.\n\n**Cythère** - Elise, Sydell. Une maison qui a fusionné avec la maison Zaavan avec un mariage soigneusement planifié par Elise, sa précédente matrone.\n\n**Zaavan** - Berholdt, Élise. Une maison qui a fusionné avec la maison Kythera avec un mariage soigneusement planifié par Elise, sa matrone actuelle.;**Noble houses of Noxus** :\n\n**Darkwill** - Boram, Keiran. Former rulling house of Noxus, before Jericho's coup and the installing of The Trifarix.\n\n**Granth** - Brannin, Hadrion. A house that remained loyal to Darkwill during the revolution, it's most notorious members were stripped of their possessions and two of its members were later killed in attempts of revenge, one of those attempts being linked to LeBlanc's schemings.\n\n**Du Couteau** - Marcus, Soreana, Cassiopeia, Katarina, Talon. A house of assassins and spies. Its previous patron was instrumental in establishing The Trifarix while its matron was a member of The Black Rose.\n\n**Sassen** - Emet. A house whose lord was swayed by the charms of Lady Elise and was never seen again.\n\n**Swain** - Jericho. One of the first noble houses in Noxus. After Jericho sold them out for plotting against the empire, most if not all other members of the house were executed.\n\n**Tewain** - The noble house responsible for gaining favor of numerous Minotaur clans before claiming Basilich. Its matron was killed by Alistar, who rejected the alliance.\n\n**Kythera** - Elise, Sydell. A house that merged with House Zaavan with a carefully planned marriage by Elise, its previous matron.\n\n**Zaavan** - Berholdt, Elise. A house that merged with House Kythera with a carefully planned marriage by Elise, its current matron.;Noxus, Swain, Leblanc, Cassiopeia, Katarina, Talon, Alistar, Elise
Noxus;La force vitale de l'empire permet à la nation expansionniste de conquérir des terres fertiles pour suppléer à son manque.\n\nLes armées de Noxus ne semblent être que des barbares guerre, mais cela dément la discipline et la sophistication requises pour rendre une telle formation viable. Noxus renonce à un ordre standardisé strict et rigide - on trouve au combat des petits groupes de guerre, des hôtes de guerre plus grands et des légions massives - en faveur de permettre à leurs forces de se spécialiser dans ce qu'elles font le mieux, en les dirigeant vers des tâches ou des domaines où leurs forces peuvent mieux servir l'empire. Au sein de l'armée noxienne, les chances sont égales pour tous, car tout le monde commence au même rang. En première ligne, un esclave étranger sera l'égal d'un noble de haute naissance.\n\nLe succès des armées noxiennes est indéniable, et leur diversité même témoigne de leur efficacité. Les peuples conquis qui jurent fidélité à Noxus font partie de ses armées et ajoutent leurs forces uniques aux efforts de guerre de l'empire. Ainsi, la réglementation et l'uniformité sont un anathème pour le mode de vie noxien, et chaque groupe de guerre est célébrée pour les méthodes de guerre nombreuses et variées qu'elle apporte à la table.;The lifeblood of the empire allowing the expansionist nation to conquer fertile lands to supplement its lack thereof.\n\nThe armies of Noxus appear to be little more than barbarous hosts of individual warbands, but this belies the discipline and sophistication required to make such a formation viable. Noxus foregoes a strict rigid standardized order - there are merely smaller warbands, larger warhosts, and massive legions - in favor of allowing their forces to specialize in what they do best, directing them to tasks or areas where their strengths can serve the empire best. Within the Noxian army, there are equal chances for anyone: everyone starts on the same rank. On the front lines, a foreign slave could be the equal of a highborn noble.\n\nThe success of Noxian armies is undeniable, and their very diversity is a testament to their effectiveness. Conquered peoples that swear loyalty to Noxus become part of its armies and add their unique strengths to the empire's war efforts. Thus, regimentation and uniformity are anathema to the Noxian way of life, and each warband is celebrated for the many and varied methods of war it brings to the table.;Noxus
Noxus;**Rangs militaires à Noxus** :\n\n**Navy** - Collection de navires de guerre et de commerce de Noxus.\n\n**Amiral** - Chef d'une flotte navale.\n\n**Légion** - Un grand collectif de chefs de guerre, généralement organisé pour mettre en scène la conquête d'une grande région.\n\n**Commander** - Chef d'une légion.\n\n**Lord Commander** - Leader avec un titre distingué.\n\n**Warhost** - Un groupe organisé de bandes de guerre, rassemblées pour conquérir de petites régions et des cités-états ou combattre des armées rivales. Au sein d'une légion, les warhosts seront chargés d'attaquer simultanément différentes régions afin de prendre le contrôle d'une grande région plus efficacement.\n\n**Général** - Leader d'un warhost.\n\n**Bande de guerre** - Unités individuelles et localisées de l'armée de Noxus. Habituellement organisées par des citoyens du territoire conquis, ces unités sont dirigées par leurs propres chefs, maréchaux et capitaines. Chaque bande est unique, avec sa propre culture, sa hiérarchie et son mode de guerre préféré. Ils remplissent des rôles spécifiques dans le cadre d'un hôte de guerre beaucoup plus grand, combattant peut-être en tant que troupes de choc de première ligne, infanterie lourde, éclaireurs, assassins ou cavalerie.\n\n**Capitaine** - Leader d'une bande de guerre, souvent un chef, un gouverneur ou un maréchal.\n\n**Warmasons** - Une branche militaire distincte d'éclaireurs, d'ingénieurs et de guerriers ingénieux qui conçoivent et supervisent la construction de routes, de ponts et de fortifications avant, pendant et après un conflit. La première indication de l'expansion noxienne est qu'un ou deux warmasons explorent le territoire ennemi à la recherche d'itinéraires d'invasion possibles, généralement sous couverture. Ils effectuent des reconnaissances et sont chargés de cartographier le tracé détaillé du territoire, de gagner la confiance et d'identifier les forces et les faiblesses de l'ennemi.;**Military ranks in Noxus** :\n\n**Navy** - Noxus' collection of warships and trade ships. \n\n**Admiral** - Leader of a naval fleet. \n\n**Legion** - A large collective of warhosts, usually organized to stage the conquest of a large region. \n\n**Commander** - Leader of a legion.\n\n**Lord Commander** - Leader with a distinguished title. \n\n**Warhost** - An organized group of warbands, assembled to conquer small regions and city-states or combat rival armies. Within a legion, warhosts will be assigned to simultaneously attack different regions in order to take control of a large region more effectively. \n\n**General** - Leader of a warhost.\n\n**Warband** - Individual, localized units of Noxus' army. Usually organized by citizens of conquered territory, these units are led by their own chieftains, marshals, and captains. Each warband is unique, with its own culture, hierarchy and favored way of war. They fulfill specific roles as part of a much larger warhost, perhaps fighting as frontline shock troops, heavy infantry, scouts, assassins or cavalry — whatever best suits their skills.\n\n**Captain** - Leader of a warband, often a chieftain, governor, or marshal.\n\n**Warmasons** - A distinct military branch of resourceful scouts, engineers, and warriors who design and oversee the construction of roads, bridges and fortifications before, during and after a conflict. The first indication of Noxian expansion is one or two warmasons scouting enemy territory for possible invasion routes, usually undercover. They scout ahead and are responsible for mapping the detailed layout of enemy territory, gaining enemy trust, and identifying enemy strengths and weaknesses.;Noxus
Noxus;**Forces spéciales à Noxus** :\n\n**Arcane Fist** - Une bande d'élite de warmages, décimée après une expédition dans les montagnes Greenfang près de Demacia.\n\n**Bloodrunners** - Un peloton spécial de mages de sang, portant des lames crochues.\n\n**Fury Company** - La compagnie de soldats de Riven.\n\n**Xamari Redblades** - Réputés pour leur habileté avec de longues lames d'acier trempé dans le sang. Les maîtres-épéistes Xamari font vœu de silence, devenant le fléau des commandants ennemis alors qu'ils échappent facilement aux gardes du corps.\n\n**La Première Légion** - Parmi les légions originales de la longue histoire de Noxus.\n\n**Légion trifarienne** - La légion la plus élitiste et la plus loyale de Noxus moderne.;**Special Forces in Noxus** :\n\n**Arcane Fist** - An elite band of warmages, decimated after an expedition to the Greenfang Mountains near Demacia.\n\n**Bloodrunners** - A special platoon of bloodmages, carrying hooked blades.\n\n**Fury Company** - Riven's company of soldiers.\n\n**Xamari Redblades** - Renowned for their skill with long blades of blood-quenched steel. Xamari swordmasters take vows of silence, becoming the bane of enemy commanders as they evade bodyguards and life-wards with ease.\n\n**The First Legion** - Among the original legions from Noxus's long history.\n\n**Trifarian Legion** - The most elite and loyal legion in modern Noxus.;Noxus, Riven
Noxus;La Rose Noire, dirigée par LeBlanc, est ce qui reste d'une cabale secrète qui existe depuis bien plus longtemps que Noxus. Les Initiés de la Rose Noire ont comploté dans l'ombre pendant des siècles, cherchant à gagner du pouvoir de toutes les manières possibles, attirant les riches et les puissants - mages, nobles et politiciens - dans leurs rangs.\n\nIls se mêlent des pouvoirs les plus sombres de la magie, de la manipulation, de l'assassinat et de la tromperie et partagent des connaissances et des secrets cachés, afin de développer leurs zones d'influence et de pouvoir.\n\nLes zones du domaine de la Rose Noire sont discrètement marquées par leur sceau, gravé sur des arcades ombragées.\n\nPeu de personnes connaissent les « origines » de leur matrone, bien que beaucoup aient découvert les légendes d'une sorcière pâle qui a aidé les tribus barbares brisées, dans leur lutte contre l'infâme Revenant de Fer.\n\nLa Rose Noire existe maintenant pour promouvoir les intérêts clandestins de ceux qui peuvent manier la magie noire cachée dans le Bastion Immortel - avec sa base composée de nobles mondains, attirés par les rumeurs de miracles, tenus sous l'emprise et exploités sans pitié. Même le commandant militaire le plus puissant ne peut servir que les vrais maîtres du culte, alors qu'ils se battent pour l'influence dans des jeux d'intrigue et de conquête, à la fois dans la capitale noxienne et au-delà de ses frontières.;The Black Rose, led by LeBlanc, is what remains of a secret cabal that has existed far longer than Noxus itself. Initiates of the Black Rose have schemed from the shadows for centuries, looking to gain power in any way they can, drawing the rich and powerful - mages, nobles, and politicians alike - to their ranks.\n\nThey dabble in the darker powers of magic, manipulation, assassination and deception and share hidden knowledge and secrets, in order to grow their areas of influence and power.\n\nAreas within the Black Rose's domain are discreetly marked by their sigil, etched onto shadowed archways.\n\nOnly an elite few learn the “origins” of their matron, though many have uncovered legends of a pale sorceress who aided the broken barbarian tribes, in their struggle against the infamous Iron Revenant.\n\nThe Black Rose exists now to further the clandestine interests of those who can wield the dark magic hidden within the Immortal Bastion — with its rank-and-file composed of mundane nobles, drawn to rumors of miracles, kept in thrall and ruthlessly exploited. Even the most powerful military commander could only ever serve the cult's true masters, as they fight one another for influence in games of intrigue and conquest, both in the Noxian capital and beyond its borders.;Noxus, Leblanc
Noxus;Sous la tutelle de Vladimir, l'art de l'hémomancie a trouvé sa place dans l'armée de Noxus et parmi les rejetons de la vieille aristocratie. Parmi ces divers praticiens se trouve le Crimson Circle, un culte juvénile dédié autant à la personnalité de Vladimir qu'à la magie du sang elle-même.;Under Vladimir's tutelage, the art of hemomancy has found a place in the military of Noxus, and among scions of the old aristocracy. Among these diverse practitioners is the Crimson Circle, a youthful cult dedicated as much to Vladimir's personality as to blood magic itself.;Noxus, Vladimir
Noxus;À Noxus, des guerriers gladiateurs connus sous le nom de Reckoners s'affrontent dans des arènes vicieuses où le sang coule et la force est mise à l'épreuve, mais aucun n'a jamais été aussi célèbre que Draven. Xin Zhao est un ancien Reckoner et est connu sous le nom de Viscero Xin Zhao.;In Noxus, gladiator warriors known as Reckoners face one another in vicious arenas where blood is spilled and strength is tested- but none has ever been so celebrated as Draven. Xin Zhao is a former Reckoner and is known as Viscero Xin Zhao;Noxus, Draven, XinZhao
Noxus;Dans League of Legends, Noxus représente le rang Grandmaster.;;Noxus
