Name;Text;OriginalText;Tags
Noxus;**Lieux iconiques à Noxus 3/3** :\n\n         - **Trannit** : Situé sur la côte de la Mer des Gardiens et à l'ouest d'Ironwater, Trannit est actuellement gouverné par l'intendant Eranolaj Smik. Il exporte principalement du poisson Bolbo séché, qui peut être transformé en une spécialité locale - une soupe de tête de Bolbo bouillie.\n\n         - **Vindor** : Situé au sud de Basilich et à l'ouest des îles Fallgren, la ville est actuellement gouvernée par l'intendant Amenesce. La ville est bien connue pour sa race de cheval Light Vindoran, élevée pour le désert. On dit que les Noxian Dark Riders ne chevauchent que des races de cette région.\n\n     - **Monts de Varju** : Une petite chaîne de montagnes bordant les Monts d'Argent.\n\n         - **Rokrund Plains** : Les plaines sont situées au pied des montagnes de Vajru.\n\n             - **Rokrund** : Situé sur les plaines de Rokrund au sud de Valoran, et voisin de Qualthala. Rokrund est actuellement gouverné par l'intendant Katye. Son principal produit d'exportation est le naap, un type de légume-racine tordu.\n\n             - **Qualthala** : Le site du Siège de Qualthala, dirigé par Kled.;**Locations iconiques à Noxus 3/3** : \n\n        - **Trannit**: Located on the coast of the Guardian's Sea and west of Ironwater, Trannit is currently governed by steward Eranolaj Smik. It primarily exports dried Bolbo fish, which can be made into a local delicacy - boiled Bolbo-head soup.\n\n        - **Vindor**: Located south of Basilich and west of the Fallgren islands, it is currently governed by Steward Amenesce. The city is well known for its Light Vindoran horse breed, bred for desert use. The Noxian Dark Riders are said to specifically only ride breeds from this area.\n\n    - **Varju Mountains**: A small mountain range bordering the Argent Mountains.\n\n        - **Rokrund Plains**: The Plains are located at the footholds of the Vajru Mountains.\n\n            - **Rokrund**: Located on the Rokrund Plains in southern Valoran, and neighbor to Qualthala. Rokrund is currently governed by steward Katye. Its primary export is the naap, a type of twisting root vegetable.\n\n            - **Qualthala**: The site of the Siege of Qualthala, led by Kled.;Noxus, Kled
Noxus;**Territoires Noxiens à Ionia** :\n\n     - **Bahrl** : Une île dans la partie centrale de la chaîne, au sud de l'île principale d'Ionia. Les villages de Tevasa et Wuju sont situés ici, tout comme la rivière Epool, où Zed a trouvé Kayn. C'est la vue des premières utilisations noxiennes des armes biologiques zaunites. À ce jour, Noxus contrôle la moitié inférieure de la province insulaire.\n\n     - **Fae'lor** : Une petite île à l'ouest de l'île principale d'Ionia. C'est l'emplacement du Dael'eh Ahira, le Bassin des Rêves, qui emprisonnait auparavant Syndra. Sa célèbre école monastique a été transformée en fort noxien lors de l'invasion. L'île a depuis été mise à nu par le pouvoir de Syndra et le fort a été arraché de ses fondations.\n\n     - **Château de Fae'lor** : La forteresse de Fae'lor a été construite sur l'île la plus à l'ouest d'Ionia. Hautement défendable, cet endroit était resté pendant des siècles face à d'innombrables ennemis, avant d'être finalement envahi après un long siège lors de l'invasion noxienne. Sa célèbre école monastique a été transformée en fort noxien après l'invasion.\n\n         - **Dael'eh Ahira Pool** : Dael'eh Ahira, ou la Piscine des rêves, une piscine spirituellement magique qui emprisonnait auparavant Syndra. Actuellement, il emprisonne un Vastaya nommé Kalan.\n\n     - **Navori** : Située sur l'Ionia, la province de Navori s'étend sur la moitié ouest d'Ionia et abrite divers villages, des écoles prestigieuses, des jardins magiques sacrés et l'emblématique Placidium de Navori. Noxus contrôle la bordure sud-ouest de la province.;**Territoires Noxiens à Ionia** :\n\n    - **Bahrl**: An island in the central part of the chain, south of the main island of Ionia. The villages of Tevasa and Wuju are located here, as is the Epool River, where Zed found Kayn. It is the sight of the first Noxian uses of Zaunite bio weapons. To this day Noxus controls the lower half of the island province.\n\n    - **Fae'lor**: A small island to the west of the main island of Ionia. It is the location of the Dael'eh Ahira, the Dreaming Pool, which previously imprisoned Syndra. Its famous monastery school was converted into a Noxian fort during the invasion. The island has since been stripped bare by Syndra's power, and the fort ripped free of its foundations.\n\n    - **Fae'lor Castle**: The fortress of Fae'lor was built upon the westernmost island of Ionia. Highly defensible, this place had remained for centuries, standing against countless foes, before being finally overrun after a long siege during the Noxian invasion. Its famous monastery school was converted into a Noxian fort during the invasion.\n\n        - **Dael'eh Ahira Pool**: Dael'eh Ahira, or the Dreaming Pool, a spiritually magical pool that previously imprisoned Syndra. Currently it imprisons a vastaya named Kalan.\n\n    - **Navori**: Located on Ionia, the province of Navori spans the western half of Ionia and is home to various villages, prestigious schools, sacred magical gardens, and the iconic Placidium of Navori. Noxus controls the southwestern edge of the province.;Noxus, Zed, Kayn, Syndra
Noxus;**Territoires Noxiens à Shurima** :\n\n     - **Bel'zhun** : Situé au nord de Shurima, cet avant-poste était auparavant contrôlé par Hagyos Valif et Hazir Ima'Sai mais est actuellement dirigé par un intendant noxien nommé Dorrik. La ville a connu une importante insurrection rebelle contre la domination noxienne. Connus sous le nom de Soleils de Bel'Zhun, ils échangent fréquemment des armes avec le Clan Medarda de Piltover. Les plaques et la laine des indigènes Hwatis, créatures ressemblant à des chèvres avec des casques osseux sur la tête, sont prisées pour le feutrage et l'isolation.\n\n     - **Tereshni** : Cette ville portuaire shurimane est actuellement contrôlée par Noxus et dirigée par l'intendant Ta'Fik. L'exportation la plus connue de la ville est l'azirite shurimane (alias verre de sang), du nom de l'actuel empereur shuriman, Azir.\n\n     - **Urzeris** : Située sur la côte nord de Shurima, cette ville portuaire est actuellement occupée par Noxus, et son gouverneur actuel est Steward Zikka Taum'Vin. Son produit commercial le plus connu est le sel d'Urzeris. Marcus Du Couteau avec sa famille était en poste près du gouverneur d'Uzeris avant son assassinat. Katarina et Cassiopée ont vécu ici pendant leurs jeunes années.;**Territoires Noxiens à Shurima** :\n\n    - **Bel'zhun**: Located in northern Shurima, this outpost has previously been controlled by Hagyos Valif and Hazir Ima'Sai but is currently led by a Noxian steward named Dorrik. The city has had a large rebel insurgency against Noxian rule. Known as the Suns of Bel'Zhun, they frequently trade weapons with Clan Medarda of Piltover. The plates and wool of the native Hwatis, goatlike creatures with bony casques on their heads, are prized for felting and insulation.\n\n    - **Tereshni**: This Shuriman port city is currently controlled by Noxus and led by Steward Ta'Fik. The city's best-known export is Shuriman Azirite (aka blood glass), named after the current Shuriman Emperor, Azir.\n\n    - **Urzeris**: Located in the northern coast of Shurima, this port city is currently occupied by Noxus, and its current governor is Steward Zikka Taum'Vin. Its most well known trade good is Urzeris Salt. Marcus Du Couteau with his family was stationed close to the governor of Uzeris before his assassination. Both Katarina and Cassiopeia lived here during their younger years.;Noxus, Azir, Katarina, Cassiopeia
Noxus;Les arachnides connues sous le nom de Spiderlings sont les enfants géants d'Elise et de Vilemaw et résident à la fois à Noxus et dans les îles obscures. Grandes araignées sombres aux reflets rouges, elles se régalent de la chair vivante des humains et d'autres grandes proies. Vivant en groupe, ils ont acquis un esprit de ruche les uns avec les autres ainsi qu'avec leur reine araignée Elise.;Arachnids known as Spiderlings are the giant children of Elise and Vilemaw and reside in both Noxus and the Shadow Isles. Large dark spiders with red highlights, they feast upon living the flesh of humans and other large prey. Living in groups, they gained a hive mind with each other as well as their Spider Queen Elise.;Noxus, Elise, Spiderling
Noxus;Reptiles monstrueux des jungles orientales du continent Shuriman, les basilics sont de féroces prédateurs sauriens qui peuvent atteindre des tailles gargantuesques, peu peuvent résister à leur charge. Les juvéniles sont des bêtes de somme prisées, et peu de personnes peuvent résister à leur charge. Une fois devenus trop grands pour être contrôlés par un cavalier, ils sont utilisés comme bêtes de somme, ou parfois comme béliers vivants pour démolir les murs des villes assiégées. Ils sont recouverts d'une épaisse peau verdâtre, dure comme du fer, qui était utilisée pour se camoufler dans les épaisses jungles indigènes ainsi que pour se protéger. Ils ont également des extensions de type aileron sur le dos et le bas des jambes, faisant allusion à leur capacité à traverser les zones marécageuses. Outre leurs cornes avant, les créatures ont une queue forte utilisée pour nager et frapper d'autres ennemis.;Monstrous reptiles from the eastern jungles of Shuriman Continent, basilisks are fierce saurian predators that can grow to gargantuan sizes, few can stand against their charge. Juveniles are prized riding beasts, and only a few can stand against their charge. After they become too large for a rider to control, they are used as beasts of burden, or sometimes as living battering rams to smash down the walls of besieged cities. They are covered in thick greenish hide, hard as iron, which was used for camouflage in the thick native jungles as well as protection. They also have fin type extensions on their backs and back lower legs, hinting on their proficiency in traversing swampy areas. Other than their front horns, the creatures have strong a strong tail used for swimming and hitting other enemies.;Noxus, Basilik
Noxus;Originaire de la steppe du nord, le drakalop est une espèce d'herbivore immortel ressemblant à un lézard connu pour sa vitesse incroyable sur terre. Skaarl en fait partie.;Native to the northern steppe, drakalops are a species of immortal, lizardlike herbivore known for their incredible speed on land. Skaarl is one of these.;Noxus, Drakalops, Kled
Noxus;Une Nightbloom est une fleur rare aux pétales rouge feu originaire des îles bénies. elle est pratiquement disparue à l'exception de quelques buissons dont on s'occupe dans le jardin de Vladimir dans son manoir à Noxus. Sur les îles bénies, elles fleurissaient le soir du solstice d'été. Au matin, les fleurs se fanent, ne laissant que des pétales noircis, qu'on ne reverra que l'année suivante. Mais pendant une nuit, ils ont illuminé la forêt d'un cramoisi flamboyant. Si les pétales des fleurs sont cueillis, les pétales restants s'enroulent immédiatement vers l'intérieur, la tige se pliant comme si elle pouvait exprimer la peur.;Nightbloom are a rare flame-red petaled flower native to the Blessed Isles. It is virtually extinct except for a few who bushes that are cared for in Vladimir's garden in his mansion in Noxus. On the Blessed Isles they blossomed on the evening of the summer solstice. By morning the flowers wilted, leaving only blackened petals, not to be seen again until the following year. But for one night, they illuminated the forest with blazing crimson. If the flowers petals are plucked the remaining petals immediately curl inwards, the stem bending away as if it can express fear.;Noxus, Nightbloom, Vladimir
Noxus;Originaires des terres conquises de Noxus, les oranges de Noxus sont des agrume qui sont la principale source de vitamine C pour les pirates Bilgewater qui prévient le scorbut. Ils sont plus sucrés que les autres variétés d'agrumes trouvées sur Runeterra.;Originating from the conquered lands of Noxus, Noxian Oranges are citrus fruits which is the primary source of Vitamin C for Bilgewater pirates that prevents scurvy. They are on the sweeter side, compared to other varieties of citrus fruit found on Runeterra.;Noxus, CitrusFruit, Bilgewater
Noxus;Il y a au moins un type de poro trouvé à Noxus, nommé le poro affectueux;;Noxus, Poro
Noxus;Les Tuskbeasts sont des éléphants géants utilisés par Noxus comme tanks vivants. Ils ressemblent aux mammouths de Freljord avec leurs grandes défenses incurvées et leurs petites oreilles. Ce qui diffère, c'est qu'ils n'ont pas de manteau de fourrure pour les protéger des intempéries hivernales. Les cavaliers de bêtes de guerre noxiennes montent généralement des armures lourdes sur eux pour les protéger de toute artillerie ennemie.;Tuskbeasts are giant elephants used by Noxus as living tanks. They resemble Freljordian Mammoths in that they have large curved tusks and small ears. What differs is that they don't have a coat of fur to protect them from winter weather. Noxian warbeast riders usually mount heavy armor on them to protect them from any enemy artillery.;Noxus, Tuskbeast
Noxus;Les bolbos sont un type de poisson originaire des côtes de Grannit. Leurs visages ont une apparence humanoïde et sont meilleurs lorsqu'ils sont séchés, bien que les soupes bouillies à la tête de Bolbo soient également une option.;Bolbos are a type of fish native to the shores of Grannit. Their faces have a humanoid like appearance and are best when dried, though boiled Bolbo-head soups are also an option.;Noxus, Bolbos
Noxus;Les Noxiens respectent la force par-dessus tout, et la seule façon de rester fort est d'être constamment mis à l'épreuve. Ils savourent l'opportunité de rivaliser les uns avec les autres, car ne pas être défiés, c'est s'affaiblir, et même ceux qui sont au sommet du pouvoir doivent toujours chercher de nouvelles façons de se défier... ou ils ne resteront pas longtemps au pouvoir. Ce n'est pas seulement la force physique ou martiale que les Noxiens admirent - ceux qui font preuve d'expertise en politique, en artisanat, en commerce et en magie contribuent tous à créer un Noxus plus fort.\n\nN'importe qui peut prospérer à Noxus, quelle que soit son origine, tant qu'il a la volonté de réussir. Le seigneur de guerre Darius en est un parfait exemple, s'élevant de rien pour devenir l'un des chefs les plus puissants de l'empire. Malgré cet idéal méritocratique, les anciennes familles nobles exercent toujours un pouvoir considérable au cœur de l'empire, et certains craignent que la plus grande menace pour Noxus ne vienne pas de ses ennemis, mais de l'intérieur.;Noxians respect strength above all things, and the only way to remain strong is to be constantly tested. They relish the opportunity to compete with one another, since to not be challenged is to grow weak, and even those at the peak of power must always seek new ways to challenge themselves... or they will not remain in power for long. It is not just physical or martial strength that Noxians admire - those who demonstrate expertise in politics, craftsmanship, trade, and magic all help to create a stronger Noxus.\n\nAnyone can prosper in Noxus, no matter their background, so long as they have the strength of will, and the drive to succeed. The warlord Darius is a perfect example of this, rising from nothing to become one of the empire's most powerful leaders. Despite this meritocratic ideal, the old noble families still wield considerable power at the heart of the empire, and some fear that the greatest threat to Noxus comes not from its enemies, but from within.;Noxus
Noxus;"Alors que Noxus s'étend et vainc les cultures et les villes voisines, il offre un choix aux peuples conquis ; jurez fidélité à Noxus et soyez jugé uniquement sur votre valeur, ou soyez détruit. Ce n'est pas un subterfuge ou une quelconque ruse ; les Noxiens tiennent parole, et beaucoup de ceux qui ont adopté le mode de vie de leurs conquérants voient leurs perspectives grandement améliorées. Mais ceux qui refusent de plier le genou sont écrasés sans pitié.\n\nQu'une ville soit prise par la force ou jure volontairement fidélité à Noxus, ses Warmasons se mettent immédiatement au travail pour imposer l'autorité de l'empire sur le territoire nouvellement acquis. Des passerelles de pierre sombre extraites des montagnes entourant la capitale sont érigées sur chaque route menant à la ville. Connues dans tout Valoran sous le nom de Noxtoraa (porte de Noxus à Ur-Nox), ces structures imposantes ne laissent aucun doute aux voyageurs qui approchent sur qui détient les rênes du pouvoir.\n\nChaque ville conquise a un intendant assigné pour gouverner et faire respecter la loi et l'autorité noxiennes.";"As Noxus expands and defeats neighboring cultures and cities, it offers the conquered people a choice; swear loyalty to Noxus and be judged solely on your worth, or be destroyed. This is not subterfuge or any kind of ruse; the Noxians are as good as their word, and many who have embraced their conquerors' way of life find their prospects greatly improved. But those who refuse to bend the knee are crushed without mercy.\n\nWhether a city is taken by force or willingly swears fealty to Noxus, its Warmasons immediately set to work in stamping the empire's authority upon the newly acquired territory. Gateways of dark stone quarried from the mountains surrounding the capital are raised on every road leading to the city. Known throughout Valoran as Noxtoraa (gateway to Noxus in Ur-Nox) these towering structures leave approaching travelers in no doubt as to who holds the reins of power.\n\nEvery city conquered has an assigned Steward to govern and uphold Noxian law and authority.";Noxus
Noxus;Les Kindred sont bien connus et suivis à Noxus. L'agneau représente une fin pacifique tandis que le loup représente une fin violente. Puisque les Noxiens, en particulier les militaires, jurent de se battre jusqu'à la mort, le loup est honoré avec plus de rigueur et de panoplie que l’agneau. Le sanctuaire du loup se trouve dans la forteresse de la capitale.\n\nLe sanctuaire est une haute tour à plusieurs niveaux avec des côtés ouverts, s'appuyant contre les anciens remparts sud du Bastion immortel. Chaque niveau de la tour est soutenu par trois piliers de pierre sombre. Au centre de la tour, qui s'élève à près de cinquante pieds de haut, se trouve une statue massive en obsidienne d'un loup assis.;The Kindred are well known and followed in Noxus. Lamb represents a peaceful end while the Wolf represents a violent end. Since Noxians, especially the military, vow to fight to the death, Wolf is honored with more rigor and panoply than Lamb. The Shrine to Wolf can be found in the capital fortress.\n\nThe shrine is a tall, multi-tiered tower with open sides, butting up against the old southern bulwarks of the Immortal Bastion. Each level of the tower is held aloft by three pillars of dark stone. In the center of the tower, looming almost fifty feet high, is a massive obsidian statue of a seated wolf.;Noxus, Kindred
Noxus;Les histoires de la créature connue sous le nom de Fiddlesticks sont racontées parmi les soldats noxiens. Leur version de la fable raconte l'histoire d'un ouvrier agricole solitaire qui a été blâmé pour une mauvaise récolte et, par conséquent, a été attaché dans un champ et laissé dévoré par les corbeaux - pour revenir dans le monde en tant que démon. On dit qu'il rôde toujours dans les champs, tuant tous les voyageurs qui osent entrer dans son domaine.;Tales of the creature known as Fiddlesticks are told among Noxian soldiers. Their version of the fable tells of a lonely farmhand who was blamed for a poor harvest, and as a result was tied up on a field and left to be devoured by the crows - only to return to the world as a demon. It is said that he still stalks the fields, slaying any travelers who dare enter his domain.;Noxus, Fiddlestick
Noxus;"La méritocratie de Noxus est illustrée par la doctrine Trifarix, également connue sous le nom de ""Principes de force"". Celui-ci est composé de trois aspects fondamentaux : puissance, vision et ruse. Chaque citoyen doit s'efforcer d'incarner les trois comme un idéal de prospérité, car s'ils sont faibles dans l'un, cela pourrait faire vaciller l'empire.";"Noxus meritocracy is exemplified by the Trifarix doctrine, otherwise known as the ""Principles of Strength"". This is made up of three core aspects. Might, Vision, and Guile. Each citizen must strive to embody all three as an ideal for prosperity, as if they are weak in one it could falter the empire.";Noxus
Noxus;Noxus était autrefois gouverné par la volonté d'empereurs faillibles, le dernier étant Boram Darkwill. Depuis l'arrivée au pouvoir de Swain, Noxus n'est plus gouverné par un individu mais plutôt par une triade de dirigeants égaux connus sous le nom de Conseil des Trois, chacun représentant l'un des principes fondamentaux de la force. Selon le raisonnement de Swain, alors qu'une seule personne pourrait condamner Noxus par incompétence, folie ou corruption, un groupe de trois dirigeants aurait toujours deux personnes pour tenir quelqu’un de corrompu responsable, garantissant qu'aucun individu ne puisse gouverner Noxus sans opposition.\n\nLes trois membres sont :\n\n     - **Darius**, la Main de Noxus, incarnant le Principe de la Puissance : Commandant de l'élite de la Légion Trifarian.\n\n     - **Jericho Swain**, le Grand Général de Noxian, incarnant le Principe de Vision : Face principale du gouvernement de l'Empire. A renversé l'ancienne maison au pouvoir de Darkwill.\n\n     - **Le Sans-Visage**, incarnant le Principe de la Ruse : Son identité est officiellement un mystère. Selon la rumeur, c’est le marionnettiste de la politique de Noxus. Le statut inconnu des étrangers convient aux objectifs des Trifarix et des Sans-Visage : semer la peur, la suspicion et le malaise parmi les ennemis de Noxus permet aux Sans-Visage de marcher plus librement parmi ceux qui pourraient être sur leurs gardes.;Noxus was once ruled by the will of fallible emperors, the last being Boram Darkwill. Since Swain's rise to power, Noxus is no longer governed by an individual but instead a triad of equal leaders known as the Council of Three, each representing one of the core Principles of Strength. According to Swain's reasoning, while a single person could doom Noxus through incompetence, madness, or corruption, a group of three would always have two individuals to hold any rogue third member accountable, ensuring that no individual can rule Noxus unopposed.\n\nThe three members are :\n\n    - **Darius**, the Hand of Noxus, incarning the Principle of Might: Commander of the elite Trifarian Legion.\n\n    - **Jericho Swain**, the Noxian Grand General, incarning the Principle of Vision: Main face of government for the Empire. Overthrew the previous ruling House of Darkwill.\n\n    - **The Faceless**, incarning the Principle of Guile: Identity is officially a mystery. Rumored to puppeteer the dark underbelly and politics of Noxus. Unknown status to outsiders suits the Trifarix's and the Faceless' purposes: sowing fear, suspicion, and unease among the enemies of Noxus allows the Faceless to walk more freely among those who might have their guard up.;Noxus, Darius, Swain
